18588956	Expression analysis of rice A20/AN1-type zinc finger genes and characterization of ZFP177 that contributes to temperature stress tolerance.	2008	Gene	The A20/AN1-type zinc finger protein family is conserved in animals and plants. Using human AWP1 protein as a query, we identified twelve A20/AN1-type zinc finger proteins in japonica rice. Most of these genes were constitutively expressed in leaves, roots, culms and spikes. Through microarray analysis, it was found that four genes (ZFP177, ZFP181, ZFP176, ZFP173), two genes (ZFP181 and ZFP176) and one gene (ZFP157) were significantly induced by cold, drought and H(2)O(2) treatments, respectively. Further expression analysis showed that ZFP177 was responsive to both cold and heat stresses, but down-regulated by salt. The subcellular localization assay indicated that ZFP177 was localized in cytoplasm in tobacco leaf and root cells. Yeast-one hybrid assay showed that ZFP177 lacked trans-activation potential in yeast cells. Overexpression of ZFP177 in tobacco conferred tolerance of transgenic plants to both low and high temperature stresses, but increased sensitivity to salt and drought stresses. Further we found expression levels of some stress-related genes were inhibited in ZFP177 transgenic plants. These results suggested that ZFP177 might play crucial but differential roles in plant responses to various abiotic stresses.
17434609	A novel rice C2H2-type zinc finger protein lacking DLN-box/EAR-motif plays a role in salt tolerance.	2007	Biochim Biophys Acta	A cDNA for the gene ZFP182, encoding a C2H2-type zinc finger protein, was cloned from rice by RT-PCR. ZFP182 codes an 18.2 kDa protein with two C2H2-type zinc finger motifs, one nuclear localization signal and one Leu-rich domain. The DLN-box/EAR-motif, which exists in most of plant C2H2-type zinc finger proteins, does not exist in ZFP182. The expression analysis showed that ZFP182 gene was constitutively expressed in leaves, culms, roots and spikes at the adult rice plants, and markedly induced in the seedlings by cold (4 degrees C), 150 mM NaCl and 0.1 mM ABA treatments. The approximate 1.4 kb promoter region of ZFP182 gene was fused into GUS reporter gene and transformed into tobacco. The histochemical analysis revealed that GUS expression could not be detected in transformed tobacco seedlings under normal conditions, but strongly observed in tobacco leaf discs and the vascular tissue of roots treated with NaCl or KCl. Expression of ZFP182 in transgenic tobacco and overexpression in rice increased plant tolerance to salt stress. These results demonstrated that ZFP182 might be involved in plant responses to salt stress.
18054244	Increased expression of the rice C-type cyclin-dependent protein kinase gene, Orysa;CDKC;1, in response to salt stress.	2008	Plant Physiol Biochem	Cyclin-dependent protein kinases (CDKs) form a conserved superfamily of eukaryotic serine/threonine protein kinases which require binding to a regulatory cyclin for activity. CDKs are organized in several gene families and are involved in different aspects of cell biology, such as gene transcription, cell proliferation and differentiation. In this study, we present the characteristics of the rice C-type CDK gene, Orysa;CDKC;1. The gene was expressed in all organs of the plant and relatively high amounts of its transcript were detected in mature leaves and panicles. This indicated a putative role during later stages of leaf and panicle development. Using yeast two-hybrid analysis, we identified Orysa;CYCT as an interactor with Orysa;CDKC;1. The expression profiles of the new Orysa;CDKC;1 in response to various factors from rice cells were compared with those of previously described Orysa;CDKA;1, and Orysa;CDKB2;1. The Orysa;CDKC;1 transcript was induced by salt stress and ABA treatments, but was unaffected by mannitol. In addition, the MBP kinase activity associated with Orysa;CDKC;1 immunocomplexes was induced under salt stress. We propose that Orysa;CDKC;1 may be involved in developmental programs, as well as in the salt- and ABA-signaling pathway.
17415667	A phosphate starvation-induced acid phosphatase from Oryza sativa: phosphate regulation and transgenic expression.	2007	Biotechnol Lett	A phosphate starvation-induced acid phosphatase cDNA was cloned from the rice, Oryza sativa. The cDNA encoding O. sativa acid phosphatase (OsACP1) has 1100 bp with an open reading frame of 274 amino acid residues. The deduced amino acid sequence of OsACP1 cDNA showed 53% identity to tomato acid phosphatase and 46-50% identity to several other plant phosphatases. OsACP1 expression was up-regulated in the rice plant and in cell culture in the absence of phosphate (Pi). The induced expression of OsACP1 was a specific response to Pi starvation, and was not affected by the deprivation of other nutrients. OsACP1 expression was responsive to the level of Pi supply, with transcripts of OsACP1 being abundant in Pi-deprived root. The OsACP1 cDNA was expressed as a 30 kDa polypeptide in baculovirus-infected insect Sf9 cells. In addition, the OsACP1 gene was introduced into Arabidopsis via Agrobacterium-mediated transformation. Functional expression of the OsACP1 gene in the transgenic Arabidopsis lines was confirmed by Northern blot and Western blot analyses, as well as phosphatase activity assays. These results suggest that the OsACP1 gene can be used to develop new transgenic dicotyledonous plants able to adapt to Pi-deficient conditions.
17666027	Rice ABERRANT PANICLE ORGANIZATION 1, encoding an F-box protein, regulates meristem fate.	2007	Plant J	Inflorescence architecture is one of the most important agronomical traits. Characterization of rice aberrant panicle organization 1 (apo1) mutants revealed that APO1 positively controls spikelet number by suppressing the precocious conversion of inflorescence meristems to spikelet meristems. In addition, APO1 is associated with the regulation of the plastchron, floral organ identity, and floral determinacy. Phenotypic analyses of apo1 and floral homeotic double mutants demonstrate that APO1 positively regulates class-C floral homeotic genes, but not class-B genes. Molecular studies revealed that APO1 encodes an F-box protein, an ortholog of Arabidopsis UNUSUAL FLORAL ORGAN (UFO), which is a positive regulator of class-B genes. Overexpression of APO1 caused an increase in inflorescence branches and spikelets. As the mutant inflorescences and flowers differed considerably between apo1 and ufo, the functions of APO1 and UFO appear to have diverged during evolution.
17531407	Characterization of a multifunctional inositol phosphate kinase from rice and barley belonging to the ATP-grasp superfamily.	2007	Gene	OsIpk and HvIpk, inositol phosphate kinases, were cloned from rice (Oryza sativa L. var. indica, IR64) and barley (Hordeum vulgare) respectively. Sequence alignment showed that they belong to the ATP-grasp family, which includes inositol 1,3,4-trisphosphate 5/6-kinase from humans and Arabidopsis. Residues that are binding sites for ATP and coordinate magnesium in absence or presence of inositol phosphate are conserved and in total 23 residues are invariant among the twelve aligned inositol phosphate kinases. The genes were heterologously expressed in Escherichia coli and kinase activity assays with 17 different isomers of inositol mono-/di-/tri-/tetra-/pentaphosphate as well as phytate were performed. The strongest activity for both kinases was observed with Ins(3,4,5,6)P(4), which candidates as the primary substrate for these kinases in plants. Several species-specific differences between the two recombinant Ipks were observed. Rice OsIpk showed detectable kinase activity towards eight different substrates, whereas barley HvIpk showed kinase activity with all the substrates including inositol mono- and bisphosphates. HvIpk showed 3-kinase activity towards the Ins(1,4,5)P(3) substrate and it also interconverted the two substrates Ins(1,3,4,5)P(4) and Ins(1,3,4,6)P(4) by isomerase activity, which was not observed for the rice homologue. Both OsIpk and HvIpk had no detectable 2-kinase activity. Furthermore, the two Ipks showed phosphatase activity towards several inositol phosphates. Expression analysis by RT-PCR demonstrated that the Ipk gene was equally expressed in different tissues and developmental stages. Taken together, these results show that the Ipk kinase plays a significant role in the inositol phosphate interacting network in plants.
2139209	Sequence of the F0-atpase proteolipid (atp9) gene from rice mitochondria.	1990	Nucleic Acids Res	
2158075	Sequence of the rice mitochondrial gene for cytochrome oxidase subunit 3.	1990	Nucleic Acids Res	
1282087	Structure and expression of the rice mitochondrial apocytochrome b gene (cob-1) and pseudogene (cob-2).	1992	Curr Genet	Rice mitochondrial DNA contains an intact copy and a pseudogene copy of a apocytochrome b gene (cob-1 and cob-2, respectively). Using primer extension and capping analyses, the transcriptional start site has been mapped; an 11-base motif at the transcription start site closely matches the consensus promoter motifs proposed for maize, wheat and soybean mitochondrial genes. Although both copies are identical in the 5' upstream region and through most of the coding region, only cob-1-specific mRNA is detected on RNA gel-blots. Run-on transcription analysis indicates, however, that both cob-1 and cob-2 mRNAs are synthesized in vivo but less cob-2 is accumulated. At its mapped 3' terminus the cob-1 transcript possesses a sequence that could fold into a double stem-loop structure. The possible roles of a double stem-loop structure in mitochondrial gene expression are discussed.
17376611	Characterization of a lipoate-protein ligase A gene of rice (Oryza sativa L.).	2007	Gene	Lipoic acid is an essential disulfide cofactor required for the lipoate-dependent enzymes including pyruvate dehydrogenase (PDH), alpha-ketoglutarate dehydrogenase (KGDH), and glycine cleavage enzymes that function in key metabolic pathways in most prokaryotes and eukaryotes. Lipoic acid is covalently bound to lipoate-dependent enzymes by lipoate-protein ligase or lipoate transferase. Here, we characterized a lipoyl-protein ligase A (OsLPLA) gene of rice. The OsLPLA gene, which encoded 270 amino acids, was located on an approximately 21 Mb of chromosome 8 on the physical map of Oryza sativa Japonica type. OsLPLA transcripts were abundantly expressed in leaves and developing seeds. The OsLPLA gene functionally complemented an Escherichia coli lplA null mutant. Furthermore, the protein expressed from the OsLPLA gene in an E. coli lplA mutant successfully transferred exogenous lipoate to lipoate-dependent enzymes, including the E2 subunits of the PDH, the E2 subunit of KGDH and the H-protein of glycine decarboxylase, confirming that rice OsLPLA successfully catalyzed covalent attachment of lipoate onto lipoate-dependent enzymes.
18205020	Overexpression of OsiSAP8, a member of stress associated protein (SAP) gene family of rice confers tolerance to salt, drought and cold stress in transgenic tobacco and rice.	2008	Plant Mol Biol	We describe here the isolation and characterization of OsiSAP8, a member of stress Associated protein (SAP) gene family from rice characterized by the presence of A20 and AN1 type Zinc finger domains. OsiSAP8 is a multiple stress inducible gene, induced by various stresses, namely heat, cold, salt, desiccation, submergence, wounding, heavy metals as well as stress hormone Abscisic acid. OsiSAP8 protein fused to GFP was localized towards the periphery of the cells in the epidermal cells of infiltrated Nicotiana benthamiana leaves. Yeast two hybrid analysis revealed that A20 and AN1 type zinc-finger domains of OsiSAP8 interact with each other. Overexpression of the gene in both transgenic tobacco and rice conferred tolerance to salt, drought and cold stress at seed germination/seedling stage as reflected by percentage of germination and gain in fresh weight after stress recovery. Transgenic rice plants were tolerant to salt and drought during anthesis stage without any yield penalty as compared to unstressed transgenic plants.
1588598	Genetic code and phylogenetic origin of oomycetous mitochondria.	1992	J Mol Evol	We sequenced the 3'-terminal part of the COX3 gene encoding cytochrome c oxidase subunit 3 from mitochondria of Phytophthora parasitica (phylum Oomycota, kingdom Protoctista). Comparison of the sequence with known COX3 genes revealed that UGG is used as a tryptophan codon in contrast to UGA in the mitochondrial codes of most organisms other than green plants. A very high AT mutation pressure operates on the mitochondrial genome of Phytophthora, as revealed by codon usage and by A+T content of noncoding regions, which seems paradoxical because AT pressure causes tryptophan codon reassignment from UGG to UGA in mitochondria of most species. The genetic code and other data suggest that mitochondria of Oomycota share a direct common ancestor with mitochondria of plants and that mitochondria of the ancestor of Planta and Oomycota were acquired in a second endosymbiotic event, which occurred later than the acquisition of mitochondria by other eukaryotes.
8675024	Gene organization in the ada-rplL region of Streptomyces virginiae.	1996	Gene	The gene organization of a 7.4-kb region of the Streptomyces virginiae (Sv) chromosome was determined. The predicted open reading frames (ORFs) and their predicted products, in sequence order, were (i) ada, encoding adenosine deaminase [EC 3.5.4.4], (ii) aat, encoding a protein homologous to aspartate aminotransferase [EC 2.6.1.1], (iii) secE, encoding a protein involved in protein secretion, (iv) vbrA, encoding a NusG-like protein involved in antitermination of transcription as described by Okamoto et al. [J. Biol. Chem. 267 (1992) 1093-1098], and (v) rplKAJL, encoding the large subunits of the ribosomal proteins L11, L1, L10 and L12. Six of the ORFs (secE-rplL) were oriented in the same direction, but the other two (ada and aat) had the opposite orientation. The gene organization of the secE-rplL region in Sv was identical to that in Escherichia coli.
17991631	Gain-of-function phenotypes of chemically synthetic CLAVATA3/ESR-related (CLE) peptides in Arabidopsis thaliana and Oryza sativa.	2007	Plant Cell Physiol	Using 26 chemically synthetic CLAVATA3/ESR (CLE) peptides, which correspond to the predicted products of the 31 Arabidopsis CLE genes, we investigated the CLE peptide function in Arabidopsis and rice. Treatment with some CLE peptides inhibited root elongation in rice as well as in Arabidopsis. It also reduced the size of the shoot apical meristem in Arabidopsis but not in rice. Database searches revealed 47 putative CLE genes in the rice genome and multiple CLE domains in some CLE genes, indicating diverse CLE function in these plants.
8806415	A ribosomal protein L2 gene is transcribed, spliced, and edited at one site in rice mitochondria.	1996	Plant Mol Biol	The mitochondrial ribosomal protein L2 gene (rpl2) is coded by two exons of 840 and 669 bp separated by an intron sequence of 1481 bp in the rice mitochondrial genome. The rpl2 gene is located three nucleotides upstream of the ribosomal protein S19 gene (rps19) and both genes are co-transcribed. cDNA sequence analysis identified splicing of the intron sequence from the rpl2 mRNA as well as RNA editing events. The deduced secondary structure of the rpl2 intron sequence shows the characteristic features of a group-II intron. A single RNA editing site is identified in rpl2 and six editing sites in rps19 transcripts. In addition, one editing site is observed in the 3 nucleotide intergenic region. Analysis of individual cDNA clones showed a different extent of RNA editing. The rice rpl2 intron is located at a different site and shows no significant nucleotide sequence similarity with the rpl2 intron of liverwort. However, 60% nucleotide sequence identity is observed between the rice rpl2 intron and the Oenothera nad5 intron in a 234 nucleotide region. The mitochondrial rpl2 sequence is absent from the pea mitochondrial genome and we consequently propose that the mitochondrial RPL2 protein is encoded by a nuclear gene in pea.
17416733	Rice NON-YELLOW COLORING1 is involved in light-harvesting complex II and grana degradation during leaf senescence.	2007	Plant Cell	Chlorophyll degradation is an aspect of leaf senescence, which is an active process to salvage nutrients from old tissues. non-yellow coloring1 (nyc1) is a rice (Oryza sativa) stay-green mutant in which chlorophyll degradation during senescence is impaired. Pigment analysis revealed that degradation of not only chlorophylls but also light-harvesting complex II (LHCII)-bound carotenoids was repressed in nyc1, in which most LHCII isoforms were selectively retained during senescence. Ultrastructural analysis of nyc1 chloroplasts revealed that large and thick grana were present even in the late stage of senescence, suggesting that degradation of LHCII is required for the proper degeneration of thylakoid membranes. Map-based cloning of NYC1 revealed that it encodes a chloroplast-localized short-chain dehydrogenase/reductase (SDR) with three transmembrane domains. The predicted structure of the NYC1 protein and the phenotype of the nyc1 mutant suggest the possibility that NYC1 is a chlorophyll b reductase. Although we were unable to detect the chlorophyll b reductase activity of NYC1, NOL (for NYC1-like), a protein closely related to NYC1 in rice, showed chlorophyll b reductase activity in vitro. We suggest that NYC1 and NOL encode chlorophyll b reductases with divergent functions. Our data collectively suggest that the identified SDR protein NYC1 plays essential roles in the regulation of LHCII and thylakoid membrane degradation during senescence.
17852346	Characterization of phosphatidylinositol-glycan biosynthesis protein class F gene in rice.	2008	DNA Seq	The glycosylphosphatidylinositol (GPI) anchors are linked to glycosylphosphatidylinositol-anchored proteins (GAPs) which are essential for the growth of mammalian, yeast and protozoan cells. The GPI anchor is covalently linked to GAP by amide bond formation between the carboxyl terminus and phosphoethanolamine attached at the third mannose and mediated by a transamidase complex. Mediation of GPI synthesis is by the sequential additions of GPI-N-acetylglucosaminyltransferase (GPI-GnT) complex, the GlcN-PI de-N-acetylase, the GlcN-PI mannosyltransferases and the GPI lipid anchor phosphoethanolamine transferase complexes. We report a rice gene OsPIG-F that encodes a homolog to the human PIG-F protein, one of GPI lipid anchor phosphoethanolamine transferase complexes. The amino acid sequences of rice PIG-F consisted of six helix transmembrane domains, one glycosaminoglycan attachment site, one cGMP-dependent protein kinase phosphorylation site and a protein C phosphorylation site at the C-terminus. This unique structure of rice PIG-F indicates the typical membrane bound structure of a protein. Polyclonal antibody for rice PIG-F was found to be cross-reactive with a protein extracted from the leaves of rice. The levels of rice PIG-F transcripts were found to be abundant in leaves, moderately in the milky stage of seed development and less in the floral spikelet, indicating that the rice PIG-F gene was differentially regulated in specific tissues. Furthermore, the levels of rice PIG-F transcription were up-regulated by growth hormones including GA(3), NAA and kinetin. These results indicated that the rice PIG-F gene expression may medicated by these growth regulators.
16792693	Cloning of two splice variants of the rice PTS1 receptor, OsPex5pL and OsPex5pS, and their functional characterization using pex5-deficient yeast and Arabidopsis.	2006	Plant J	Using the rice PEX14 cDNA as a bait in a yeast two-hybrid assay, two splice variants of the type I peroxisomal targeting signal (PTS1) receptor, OsPex5pL and OsPex5pS, were cloned from a pathogen-treated rice leaf cDNA library. The proteins were produced from a single gene by alternative splicing, which generated a full-length variant, OsPEX5L, and a variant that lacked exon 7, OsPEX5S. OsPex5pL contained 11 copies of the pentapeptide motif WXXXF/Y in its N-terminus, and seven tetratricopeptide repeats in its C-terminus. Expression of OsPEX5L and OsPEX5S predominantly occurred in leaf tissues, and was induced by various stresses, such as exposure to the pathogen Magnaporthe grisea, and treatment with fungal elicitor, methyl viologen, NaCl or hydrogen peroxide. The Arabidopsis T-DNA insertional pex5 mutant, Atpex5, which does not germinate in the absence of sucrose and was resistant to indole-3-butyric acid (IBA), was perfectly rescued by over-expression of OsPex5pL, but not by OsPex5pS. Using transient expression of OsPex5pL and OsPex5pS in the Atpex5 mutant, we show that OsPex5pL translocates both PTS1- and PTS2-containing proteins into the peroxisome by interacting with OsPex7p, whereas OsPex5pS is involved only in PTS1-dependent import in Arabidopsis.
18162592	PSY3, a new member of the phytoene synthase gene family conserved in the Poaceae and regulator of abiotic stress-induced root carotenogenesis.	2008	Plant Physiol	Abscisic acid (ABA) plays a vital role in mediating abiotic stress responses in plants. De novo ABA biosynthesis involves cleavage of carotenoid precursors by 9-cis-epoxycarotenoid dioxygenase (NCED), which is rate controlling in leaves and roots; however, additional bottlenecks in roots must be overcome, such as biosynthesis of upstream carotenoid precursors. Phytoene synthase (PSY) mediates the first committed step in carotenoid biosynthesis; with PSY3 described here, maize (Zea mays) and other members of the Poaceae have three paralogous genes, in contrast to only one in Arabidopsis thaliana. PSY gene duplication has led to subfunctionalization, with each paralog exhibiting differential gene expression. We showed that PSY3 encodes a functional enzyme for which maize transcript levels are regulated in response to abiotic stresses, drought, salt, and ABA. Drought-stressed roots showed elevated PSY3 transcripts and ABA, responses reversed by rehydration. By blocking root carotenoid biosynthesis with the maize y9 mutation, we demonstrated that PSY3 mRNA elevation correlates with carotenoid accumulation and that blocking carotenoid biosynthesis interferes with stress-induced ABA accumulation. In parallel, we observed elevated NCED transcripts and showed that, in contrast to dicots, root zeaxanthin epoxidase transcripts were unchanged. PSY3 was the only paralog for which transcripts were induced in roots and abiotic stress also affected leaf PSY2 transcript levels; PSY1 mRNA was not elevated in any tissues tested. Our results suggest that PSY3 expression influences root carotenogenesis and defines a potential bottleneck upstream of NCED; further examination of PSY3 in the grasses is of value for better understanding root-specific stress responses that impact plant yield.
17947408	The blast resistance gene Pi37 encodes a nucleotide binding site leucine-rich repeat protein and is a member of a resistance gene cluster on rice chromosome 1.	2007	Genetics	The resistance (R) gene Pi37, present in the rice cultivar St. No. 1, was isolated by an in silico map-based cloning procedure. The equivalent genetic region in Nipponbare contains four nucleotide binding site-leucine-rich repeat (NBS-LRR) type loci. These four candidates for Pi37 (Pi37-1, -2, -3, and -4) were amplified separately from St. No. 1 via long-range PCR, and cloned into a binary vector. Each construct was individually transformed into the highly blast susceptible cultivar Q1063. The subsequent complementation analysis revealed Pi37-3 to be the functional gene, while -1, -2, and -4 are probably pseudogenes. Pi37 encodes a 1290 peptide NBS-LRR product, and the presence of substitutions at two sites in the NBS region (V239A and I247M) is associated with the resistance phenotype. Semiquantitative expression analysis showed that in St. No. 1, Pi37 was constitutively expressed and only slightly induced by blast infection. Transient expression experiments indicated that the Pi37 product is restricted to the cytoplasm. Pi37-3 is thought to have evolved recently from -2, which in turn was derived from an ancestral -1 sequence. Pi37-4 is likely the most recently evolved member of the cluster and probably represents a duplication of -3. The four Pi37 paralogs are more closely related to maize rp1 than to any of the currently isolated rice blast R genes Pita, Pib, Pi9, Pi2, Piz-t, and Pi36.
1617739	Co-transcription of orf25 and coxIII in rice mitochondria.	1992	Curr Genet	Southern hybridization analysis using homologous maize probes indicated that orf25 and coxIII are closely linked in the mitochondrial genome of rice (Oryza sativa) cultivar IR36. The two coding regions were found on the same 5.1 kb BamHI fragment, and this fragment was cloned, mapped and partially sequenced. Using probes for each gene derived from the rice clone, a 2.4 kb dicistronic mRNA transcript was found containing both orf25 and coxIII coding regions. Multiple 5' ends were identified by primer extension analysis and a double stem/loop structure was mapped to the 3' end. The orf25 coding region shares greater than 85% identity with orf25 sequences from maize, tobacco and wheat, suggesting that orf25 may code for a conserved protein product.
