15951489	A sphingolipid elicitor-inducible mitogen-activated protein kinase is regulated by the small GTPase OsRac1 and heterotrimeric G-protein in rice 1[w].	2005	Plant Physiol	Mitogen-activated protein kinase (MAPK) cascades are activated in plants during responses to pathogens or to pathogen-derived elicitors and mediate intracellular stress responses. Here, we show that a rice (Oryza sativa) MAPK, OsMAPK6, was posttranslationally activated in a cell culture by a sphingolipid elicitor. Suppression of OsMAPK6 expression by RNA interference resulted in a strong reduction of pathogen-induced Phe ammonia-lyase mRNA, whereas the mRNA level of another rice MAPK, OsMAPK5a, was highly increased. Silencing of a small GTPase, OsRac1, by RNA interference or loss-of-function mutation (d1) of the heterotrimeric G-protein alpha-subunit gene resulted in a strong reduction of the OsMAPK6 protein levels and of kinase activation by a sphingolipid elicitor. Furthermore, coimmunoprecipitation experiments with OsRac1 and OsMAPK6 proteins showed that OsMAPK6 is closely associated with the active form of OsRac1, but not with inactive forms of OsRac1. These results indicate that these two G-proteins regulate an elicitor-inducible MAPK in rice at the protein level.
12751334	Cloning and prokaryotic expression of a cDNA encoding a putative mitochondrial malate dehydrogenase in Oryza sativa.	2003	DNA Seq	Malate dehydrogenase (MDH) has been characterized as a key player in oxaloacetate (OAA) biosynthesis mechanism in citrate acid cycle that generates reducing powers for further assimilation in the whole cell. Here we present the cloning, characterization and prokaryotic expression of a putative Mdh (OsmMDH) in Oryza sativa. Sequence alignment shows that there is a high homology between the deduced amino acid sequence of OsmMDH and MDH portein in Eucalyptus gunnii (80%), as well as between the deduced amino acid sequence of OsmMDH and other MDHs. Moreover, pI and the mitochondrial location of OsmMDH are predicted. The tissue-specific expression pattern of OsmMDH reveals that it is abundant in young panicle and immature seed, while its expression level is mush lower in leaf and root. Its expression in E. coli BL21 as a fusion gene is studied further.
15620222	Cloning, characterization and prokaryotic expression of cytosolic malate dehydrogenase from Oryza sativa.	2004	DNA Seq	cDNA sequences of malate dehydrogenase (MDH) were cloned from various species, and MDH was identified to play an important role in cell energy metabolism. Here, we present the isolation and characterization of its homologue (OscMDH) in Oryza sativa. Comparison of the results to the genome details indicated that OscMDH consisted of seven exons. Sequence alignment showed that the deduced amino acid sequence of OscMDH shared a significant similarity with cMDH protein in Zea mays, as well as with other cMDH gene products. The different expression patterns of OscMDH in different tissues revealed that OscMDH mRNA was highly transcribed in either young panicle or immature seed, while its abundance was much low in green leaf and root. A nearly 56-kDa fusion protein generated by adding a Trx-His-tag at the N-terminal of OscMDH was induced by IPTG in Escherichia coli BL21 and an obvious MDH activity was detected in the protein by native PAGE analysis. All these results suggest that OscMDH encodes a cytosolic MDH in rice.
15620214	Isolation, characterization and expression analysis of a leaf-specific phosphoenolpyruvate carboxylase gene in Oryza sativa.	2004	DNA Seq	Suppression subtractive hybridization was carried out to enrich gene fragments over-expressed in rice leaves by subtraction to rice roots, from which two identical cDNA fragments were identified to encode putative phosphoenolpyruvate carboxylase. Then the corresponding full-length cDNA (Osppc) is isolated by RT-PCR and sequenced, which indicates an open reading frame of 2895bp is contained. Its deduced protein is encoded in 10 exons and shows high similarity to many other plant PEPCs. Comparing with maize and bacterial PEPCs, it is revealed that OSPPC shares many conserved domains and active sites that responsible for the structure, activity and regulation of this enzyme. Phylogenetic analysis demonstrates that OSPPC is grouped with C3 form PEPCs of wheat, maize and sorghum, which is consistent with the classification of rice. And a putative promoter element is predicted with DOF binding box, CAAT box and TATA box in the 5'-flanking sequence of Osppc gene. Moreover, Quantitative RT-PCR analyses are performed in hybrid rice and its parents, which show that Osppc is specifically expressed in leaf including leaf vein and sheath.
10677431	Cloning and functional characterization of a constitutively expressed nitrate transporter gene, OsNRT1, from rice.	2000	Plant Physiol	Elucidating how rice (Oryza sativa) takes up nitrate at the molecular level could help improve the low recovery rate (<50%) of nitrogen fertilizer in rice paddies. As a first step toward that goal, we have cloned a nitrate transporter gene from rice called OsNRT1. OsNRT1 is a new member of a growing transporter family called PTR, which consists not only of nitrate transporters from higher plants that are homologs of the Arabidopsis CHL1 (AtNRT1) protein, but also peptide transporters from a wide variety of genera including animals, plants, fungi, and bacteria. However, despite the fact that OsNRT1 shares a higher degree of sequence identity with the two peptide transporters from plants (approximately 50%) than with the nitrate transporters (approximately 40%) of the PTR family, no peptide transport activity was observed when OsNRT1 was expressed in either Xenopus oocytes or yeast. Furthermore, contrasting the dual-affinity nitrate transport activity of CHL1, OsNRT1 displayed only low-affinity nitrate transport activity in Xenopus oocytes, with a K(m) value of approximately 9 mM. Northern-blot and in situ hybridization analysis indicated that OsNRT1 is constitutively expressed in the most external layer of the root, epidermis and root hair. These data strongly indicate that OsNRT1 encodes a constitutive component of a low-affinity nitrate uptake system for rice.
16169685	Identification and characterization of a novel water-deficit-suppressed gene OsARD encoding an aci-reductone-dioxygenase-like protein in rice.	2005	Gene	The aci-reductone dioxygenase (ARD) family common to bacteria, plants and animals is involved in the methionine salvage pathway. A water-deficit-suppressed gene, OsARD encoding an aci-reductone-dioxygenase-like protein, was identified from rice (Oryza sativa L.). Northern blot and reverse transcriptase-polymerase chain reaction (RT-PCR) analysis revealed that the OsARD expression is regulated by abiotic stresses and phytohormones. OsARD was mainly expressed in roots under flood conditions. It was suppressed by abiotic stresses including water deficit, high salinity and low temperature, and induced by ethylene and gibberellin acid (GA). Our results showed that the genes for S-adenosylmethionine (SAM) synthase and 1-aminocyclopropane-1-carboxylic acid (ACC) synthase were upregulated in RNA-interference (RNAi) transgenic rice plants with a significant reduction of OsARD expression. Furthermore, the expression of two genes for ethylene signal transduction, ETR2 and EIN3, increased in these RNAi transgenic plants, whereas the expression of ERF3 was suppressed. These results suggest that OsARD may play a role in the metabolism of methionine and ethylene in response to abiotic stresses.
