24584249	Genetic diversity analysis reveals that geographical environment plays a more important role than rice cultivar in Villosiclava virens population selection.	2014	Appl Environ Microbiol	Rice false smut caused by Villosiclava virens is an economically important disease of grains worldwide. The genetic diversity of 153 isolates from six fields located in Wuhan (WH), Yichang Wangjia (YCW), Yichang Yaohe (YCY), Huanggang (HG), Yangxin (YX), and Jingzhou (JZ) in Hubei province of China were phylogenetically analyzed to evaluate the influence of environments and rice cultivars on the V. virens populations. Isolates (43) from Wuhan were from two rice cultivars, Wanxian 98 and Huajing 952, while most of the other isolates from fields YCW, YCY, HG, YX, and JZ originated from different rice cultivars with different genetic backgrounds. Genetic diversity of isolates was analyzed using random amplified polymorphic DNA (RAPD) and single-nucleotide polymorphisms (SNP). The isolates from the same cultivars in Wuhan tended to group together, indicating that the cultivars had an important impact on the fungal population. The 110 isolates from individual fields tended to cluster according to geographical origin. The values of Nei's gene diversity (H) and Shannon's information index (I) showed that the genetic diversity among isolates was higher between than within geographical populations. Furthermore, mean genetic distance between groups (0.006) was higher than mean genetic distance within groups (0.0048) according to MEGA 5.2. The pairwise population fixation index (FST) values also showed significant genetic differentiation between most populations. Higher genetic similarity of isolates from individual fields but different rice cultivars suggested that the geographical factor played a more important role in the selection of V. virens isolates than rice cultivars. This information could be used to improve the management strategy for rice false smut by adjusting the cultivation measures, such as controlling fertilizer, water, and planting density, in the rice field to change the microenvironment.
24590858	Rice fertilization-Independent Endosperm1 regulates seed size under heat stress by controlling early endosperm development.	2014	Plant Physiol	Although heat stress reduces seed size in rice (Oryza sativa), little is known about the molecular mechanisms underlying the observed reduction in seed size and yield. To elucidate the mechanistic basis of heat sensitivity and reduced seed size, we imposed a moderate (34°C) and a high (42°C) heat stress treatment on developing rice seeds during the postfertilization stage. Both stress treatments reduced the final seed size. At a cellular level, the moderate heat stress resulted in precocious endosperm cellularization, whereas severe heat-stressed seeds failed to cellularize. Initiation of endosperm cellularization is a critical developmental transition required for normal seed development, and it is controlled by Polycomb Repressive Complex2 (PRC2) in Arabidopsis (Arabidopsis thaliana). We observed that a member of PRC2 called Fertilization-Independent Endosperm1 (OsFIE1) was sensitive to temperature changes, and its expression was negatively correlated with the duration of the syncytial stage during heat stress. Seeds from plants overexpressing OsFIE1 had reduced seed size and exhibited precocious cellularization. The DNA methylation status and a repressive histone modification of OsFIE1 were observed to be temperature sensitive. Our data suggested that the thermal sensitivity of seed enlargement could partly be caused by altered epigenetic regulation of endosperm development during the transition from the syncytial to the cellularized state.
24575773	What happens to plant mitochondria under low oxygen? An omics review of the responses to low oxygen and reoxygenation.	2014	Plant Cell Environ	Floods can rapidly submerge plants, limiting oxygen to the extent that oxidative phosphorylation no longer generates adequate ATP supplies. Low-oxygen tolerant plants, such as rice, are able to adequately respond to low oxygen by successfully remodelling primary and mitochondrial metabolism to partially counteract the energy crisis that ensues. In this review, we discuss how plants respond to low-oxygen stress at the transcriptomic, proteomic, metabolomic and enzyme activity levels, particularly focusing on mitochondria and interacting pathways. The role of reactive oxygen species and nitrite as an alternative electron acceptor as well as their links to respiratory chain components is discussed. By making intra-kingdom as well as cross-kingdom comparisons, conserved mechanisms of anoxia tolerance are highlighted as well as tolerance mechanisms that are specific to anoxia-tolerant rice during germination and in coleoptiles. We discuss reoxygenation as an often overlooked, yet essential stage of this environmental stress and consider the possibility that changes occurring during low oxygen may also provide benefits upon re-aeration. Finally, we consider what it takes to be low-oxygen tolerant and argue that alternative mechanisms of ATP production, glucose signalling, starch/sucrose signalling as well as reverse metabolism of fermentation end products promote the survival of rice after this debilitating stress.
24564253	Identification of putative TAL effector targets of the citrus canker pathogens shows functional convergence underlying disease development and defense response.	2014	BMC Genomics	BACKGROUND: Transcriptional activator-like (TAL) effectors, formerly known as the AvrBs3/PthA protein family, are DNA-binding effectors broadly found in Xanthomonas spp. that transactivate host genes upon injection via the bacterial type three-secretion system. Biologically relevant targets of TAL effectors, i.e. host genes whose induction is vital to establish a compatible interaction, have been reported for xanthomonads that colonize rice and pepper; however, citrus genes modulated by the TAL effectors PthA"s" and PthC"s" of the citrus canker bacteria Xanthomonas citri (Xc) and Xanthomonas aurantifolii pathotype C (XaC), respectively, are poorly characterized. Of particular interest, XaC causes canker disease in its host lemon (Citrus aurantifolia), but triggers a defense response in sweet orange.

RESULTS: Based on, 1) the TAL effector-DNA binding code, 2) gene expression data of Xc and XaC-infiltrated sweet orange leaves, and 3) citrus hypocotyls transformed with PthA2, PthA4 or PthC1, we have identified a collection of Citrus sinensis genes potentially targeted by Xc and XaC TAL effectors. Our results suggest that similar with other strains of Xanthomonas TAL effectors, PthA2 and PthA4, and PthC1 to some extent, functionally converge. In particular, towards induction of genes involved in the auxin and gibberellin synthesis and response, cell division, and defense response. We also present evidence indicating that the TAL effectors act as transcriptional repressors and that the best scoring predicted DNA targets of PthA"s" and PthC"s" in citrus promoters predominantly overlap with or localize near to TATA boxes of core promoters, supporting the idea that TAL effectors interact with the host basal transcriptional machinery to recruit the RNA pol II and start transcription.

CONCLUSIONS: The identification of PthA"s" and PthC"s" targets, such as the LOB (lateral organ boundary) and CCNBS genes that we report here, is key for the understanding of the canker symptoms development during host susceptibility, or the defenses of sweet orange against the canker bacteria. We have narrowed down candidate targets to a few, which pointed out the host metabolic pathways explored by the pathogens.
24634194	Expression of the key genes involved in ABA biosynthesis in rice implanted by ion beam.	2014	Appl Biochem Biotechnol	The plant hormone abscisic acid (ABA) plays a central role in adaptive stress responses to abiotic environments, but little information exists about its responses to implantation with low-energy ion beams. The genes related to ABA synthesis including zeaxanthin epoxidase(ZEP), 9-cis-epoxycarotenoid dioxygenase (NCED), abscisic aldehyde oxidase (AAO), short-chain dehydrogenase/reductase-like(SDR), and cytochrome P450 in rice seedlings germinating from seeds implanted by ion beam for 72, 96, and 120 h after imbibitions (HAI) were determined by real-time PCR. Moreover, we also explored the changes of endogenous ABA content in rice seedlings after 48, 72, 96, 120, and 144 h after imbibitions using enzyme-linked immunosorbent assay (ELISA). The results showed that ion beam implantation could enhance the genes' transcription activity which was involved in ABA biosynthesis. However, the response of each gene is not consistent with the underlying differences in ion flux. The obviously up-regulated expression of ZEP, AAO2, SDR, and P450-2 were observed underlying the behaviour at an ion flux of 1 × 10(17) N(+)/cm(2). However, the expression of NCED, AAO1, and SDR2 can be enhanced by 5 × 10(17) N(+)/cm(2). The expression of AAO3, SDR1, and P450-1 can be elevated underlying the both ion flux of 1 × 10(17) N(+)/cm(2) and 5 × 10(17) N(+)/cm(2). The expression of SDR3 can be enhanced in every ion flux. The results of ELISA showed that endogenous ABA level in rice seedlings increased at treatment with vacuum, 1 × 10(17) and 5 × 10(17) N(+)/cm(2). Collectively, ion beam irritation can enhance the expression of genes involved in ABA biosynthesis, resulting in increasing content of endogenous ABA in rice. Our findings suggest that ABA pathway was involved in the adaption to irradiation with ion beam in plants.
24684666	A barley PHD finger transcription factor that confers male sterility by affecting tapetal development.	2014	Plant Biotechnol J	Controlling pollen development is of major commercial importance in generating hybrid crops and selective breeding, but characterized genes for male sterility in crops are rare, with no current examples in barley. However, translation of knowledge from model species is now providing opportunities to understand and manipulate such processes in economically important crops. We have used information from regulatory networks in Arabidopsis to identify and functionally characterize a barley PHD transcription factor MALE STERTILITY1 (MS1), which expresses in the anther tapetum and plays a critical role during pollen development. Comparative analysis of Arabidopsis, rice and Brachypodium genomes was used to identify conserved regions in MS1 for primer design to amplify the barley MS1 gene; RACE-PCR was subsequently used to generate the full-length sequence. This gene shows anther-specific tapetal expression, between late tetrad stage and early microspore release. HvMS1 silencing and overexpression in barley resulted in male sterility. Additionally, HvMS1 cDNA, controlled by the native Arabidopsis MS1 promoter, successfully complemented the homozygous ms1 Arabidopsis mutant. These results confirm the conservation of MS1 function in higher plants and in particular in temperate cereals. This has provided the first example of a characterized male sterility gene in barley, which presents a valuable tool for the future control of male fertility in barley for hybrid development.
24478288	Nanohydroxyapatite shape and its potential role in bone formation: an analytical study.	2014	J R Soc Interface	Bone cells (osteoblasts) produce a collagen-rich matrix called osteoid, which is mineralized extracellularly by nanosized calcium phosphate (CaP). Synthetically produced CaP nanoparticles (NPs) have great potential for clinical application. However few studies have compared the effect of CaP NPs with different properties, such as shape and aspect ratio, on the survival and behaviour of active bone-producing cells, such as primary human osteoblasts (HOBs). This study aimed to investigate the biocompatibility and ultrastructural effects of two differently shaped hydroxyapatite [Ca10(PO4)6(OH)2] nanoparticles (HA NPs), round- (aspect ratio 2.12, AR2) and rice-shaped (aspect ratio 3.79, AR4). The ultrastructural response and initial extracellular matrix (ECM) formation of HOBs to HA NPs were observed, as well as matrix vesicle release. A transmission electron microscopy (TEM)-based X-ray microanalytical technique was used to measure cytoplasmic ion levels, including calcium (Ca), phosphorus (P), sodium (Na) and potassium (K). K/Na ratios were used as a measure of cell viability. Following HA NP stimulation, all measured cytoplasmic ion levels increased. AR2 NPs had a greater osteogenic effect on osteoblasts compared with AR4 NPs, including alkaline phosphatase activity and matrix vesicle release. However, they produced only a moderate increase in intracellular Ca and P levels compared with AR4. This suggests that particular Ca and P concentrations may be required for, or indicative of, optimal osteoblast activity. Cell viability, as measured by Na and K microanalysis, was best maintained in AR2. Initial formation of osteoblast ECM was altered in the presence of either HA NP, and immuno-TEM identified fibronectin and matrilin-3 as two ECM proteins affected. Matrilin-3 is here described for the first time as being expressed by cultured osteoblasts. In summary, this novel and in-depth study has demonstrated that HA NP shape can influence a range of different parameters related to osteoblast viability and activity.
24473456	Aspergillus cumulatus sp. nov., from rice straw and air for meju fermentation.	2014	J Microbiol Biotechnol	A new species named Aspergillus cumulatus sp. nov. is described in Aspergillus section Aspergillus (Eurotium state). The type strain (KACC 47316(T)) of this species was isolated from rice straw used in meju fermentations in Korea, and other strains were isolated from the air in a meju fermentation room. The species is characterized by growth at a wide range of water activities and the formation of aerial hyphae on malt extract 60% sucrose agar (ME60S) that resemble a cumulus cloud. Furthermore, A. cumulatus produces yellow ascomata containing small lenticular ascospores (5.1-5.7 μm) with a wide furrow, low equatorial crests, and tuberculate convex surface. The species is phylogenetically distinct from the other reported Aspergillus section Aspergillus species based on multilocus sequence typing using rDNA-ITS, β-tubulin, calmodulin, and RNA polymerase II genes.
24615161	Investment in plant research and development bears fruit in China.	2014	Plant Cell Rep	Recent rapid progress in plant science and biotechnology in China demonstrates that China's stronger support for funding in plant research and development (R&D) has borne fruit. Chinese groups have contributed major advances in a range of fields, such as rice biology, plant hormone and developmental biology, genomics and evolution, plant genetics and epigenetics, as well as plant biotechnology. Strigolactone studies including those identifying its receptor and dissecting its complex structure and signaling are representative of the recent researches from China at the forefront of the field. These advances are attributable in large part to interdisciplinary studies among scientists from plant science, chemistry, bioinformatics, structural biology, and agronomy. The platforms provided by national facilities facilitate this collaboration. As well, efficient restructuring of the top-down organization of state programs and free exploration of scientists' interests have accelerated achievements by Chinese researchers. Here, we provide a general outline of China's progress in plant R&D to highlight fields in which Chinese research has made significant contributions.
24478945	Effect of polyols on thermostability of xylanase from a tropical isolate of Aureobasidium pullulans and its application in prebleaching of rice straw pulp.	2014	Springerplus	In an attempt to find a thermostable xylanase enzyme for potential application in the pretreatment prior to H2O2 bleaching of paper pulp for industry, an extracellular xylanase from Aureobasidium pullulans CBS 135684 was purified 17.3-fold to apparent homogeneity with a recovery yield of 13.7%. Its molecular mass was approximately 72 kDa as determined by SDS-PAGE. The optimal pH and temperature for activity of the purified enzyme were pH 6.0 and 70°C, respectively. The enzyme was relatively stable at 50°C, retaining more than half of its original activity after 3-h incubation. The thermostability of the enzyme was improved by the addition of 0.75 mM sorbitol prolonging the enzyme's activity up to 10-fold at 70°C. When the potential of using the enzyme in pretreatment of rice straw pulp prior to bleaching was evaluated, the greatest efficiency was obtained in a mixture containing xylanase and sorbitol. Treatment of the rice straw pulp with xylanase prior to treatment with 10% (v/v) H2O2 and production of hand sheets increased the ISO sheet brightness by 13.5% and increased the tensile and tear strengths of the pulp by up to 1.16 and 1.71-fold, respectively, compared with pulps treated with H2O2 alone. The results suggested the potential application of the enzyme before the bleaching process of paper pulp when the maintenance of high temperature and enzyme stability are desirable.
24727792	Expression of peanut Iron Regulated Transporter 1 in tobacco and rice plants confers improved iron nutrition.	2014	Plant Physiol Biochem	Iron (Fe) limitation is a widespread agricultural problem in calcareous soils and severely limits crop production. Iron Regulated Transporter 1 (IRT1) is a key component for Fe uptake from the soil in dicot plants. In this study, the peanut (Arachis hypogaea L.) AhIRT1 was introduced into tobacco and rice plants using an Fe-deficiency-inducible artificial promoter. Induced expression of AhIRT1 in tobacco plants resulted in accumulation of Fe in young leaves under Fe deficient conditions. Even under Fe-excess conditions, the Fe concentration was also markedly enhanced, suggesting that the Fe status did not affect the uptake and translocation of Fe by AhIRT1 in the transgenic plants. Most importantly, the transgenic tobacco plants showed improved tolerance to Fe limitation in culture in two types of calcareous soils. Additionally, the induced expression of AhIRT1 in rice plants also resulted in high tolerance to low Fe availability in calcareous soils.
24648215	Seed-specific silencing of OsMRP5 reduces seed phytic acid and weight in rice.	2014	Transgenic Res	Phytic acid (PA) is poorly digested by humans and monogastric animals and negatively affects human/animal nutrition and the environment. Rice mutants with reduced PA content have been developed but are often associated with reduced seed weight and viability, lacking breeding value. In the present study, a new approach was explored to reduce seed PA while attaining competitive yield. The OsMRP5 gene, of which mutations are known to reduce seed PA as well as seed yield and viability, was down-regulated specifically in rice seeds by using an artificial microRNA driven by the rice seed specific promoter Ole18. Seed PA contents were reduced by 35.8-71.9% in brown rice grains of transgenic plants compared to their respective null plants (non-transgenic plants derived from the same event). No consistent significant differences of plant height or number of tillers per plant were observed, but significantly lower seed weights (up to 17.8% reduction) were detected in all transgenic lines compared to null plants, accompanied by reductions of seed germination and seedling emergence. It was observed that the silencing of the OsMRP5 gene increased the inorganic P (Pi) levels (up to 7.5 times) in amounts more than the reduction of PA-P in brown rice. This indicates a reduction in P content in other cellular compounds, such as lipids and nucleic acids, which may affect overall seed development. Put together, the present study demonstrated that seed specific silencing of OsMRP5 could significantly reduce the PA content and increase Pi levels in seeds; however, it also significantly lowers seed weight in rice. Discussions were made regarding future directions towards producing agronomically competitive and nutritionally valuable low PA rice.
24482434	OsRFPH2-10, a ring-H2 finger E3 ubiquitin ligase, is involved in rice antiviral defense in the early stages of rice dwarf virus infection.	2014	Mol Plant	
24728502	Multiple exposure and effects assessment of heavy metals in the population near mining area in South China.	2014	PLoS One	The objective of this study was to investigate the levels of Cd, Pb, Cu and Zn in the environment and several important food sources grown and consumed in the vicinity of Dabaoshan mine in Southern China, and evaluate potential health risks among local residents. The Cd, Pb, Cu and Zn concentrations of arable soils and well water near the mines exceeded the quality standard values. The concentrations of Cd and Pb in some food crops (rice grain, vegetable and soybean) samples were significantly higher than the maximum permissible level. The Cd and Pb concentrations in half of the chicken and fish meat samples were higher than the national standard. The residents living near Dabaoshan mine had higher Cd and Pb levels in hair than those of a non-exposed population. The intake of rice was identified as a major contributor to the estimated daily intake of these metals by the residents. The hazard index values for adults and children were 10.25 and 11.11, respectively, with most of the estimated risks coming from the intake of home-grown rice and vegetables. This study highlights the importance of multiple pathways in studying health risk assessment of heavy metal exposure in China.
24388510	Dominance and epistasis are the main contributors to heterosis for plant height in rice.	2014	Plant Sci	The genetic basis of heterosis has been debated for over 100 years regarding whether dominance or overdominance plays a more important role and the answer is still unclear. The major limitation to assess the contribution of a single locus has been the genetic background noise due to genome-wide segregation of multiple loci. To dissect the genetic basis of heterosis at a single locus for plant height, we developed a set of 202 chromosome segment substitution lines (CSSLs) of an elite hybrid, Shanyou 63, the best hybrid rice in China in the 1990s. Fifteen CSSLs had varied plant heights within lines. A total of 15 partial dominance QTLs for plant height were detected in these 15 CSSL-F2 populations. All hybrids between the 15 CSSLs and the recurrent parent, Zhenshan 97, were shorter than the corresponding CSSLs, but taller than Zhenshan 97. These indicated that these 15 QTLs were also heterosis loci (HLs) contributed to heterosis acted in dominance. Each HL contributed from -7.4 to 14.4% of midparent heterosis. Additive by additive (AA) and additive by dominance (AD) interactions were detected in the Tetra-F2 population segregating at the four major QTLs with the largest effects on plant height. Substantial negative AA effects were detected between two major QTLs QPH7.2 and QPH7.3, which increased heterosis in the study. Thus we concluded that dominance and epistasis are the major genetic basis of plant height heterosis, which could explain the better parent heterosis in Shanyou 63.
24475267	Characterizing roles for the glutathione reductase, thioredoxin reductase and thioredoxin peroxidase-encoding genes of Magnaporthe oryzae during rice blast disease.	2014	PLoS One	Understanding how pathogenic fungi adapt to host plant cells is of major concern to securing global food production. The hemibiotrophic rice blast fungus Magnaporthe oryzae, cause of the most serious disease of cultivated rice, colonizes leaf cells asymptomatically as a biotroph for 4-5 days in susceptible rice cultivars before entering its destructive necrotrophic phase. During the biotrophic growth stage, M. oryzae remains undetected in the plant while acquiring nutrients and growing cell-to-cell. Which fungal processes facilitate in planta growth and development are still being elucidated. Here, we used gene functional analysis to show how components of the NADPH-requiring glutathione and thioredoxin antioxidation systems of M. oryzae contribute to disease. Loss of glutathione reductase, thioredoxin reductase and thioredoxin peroxidase-encoding genes resulted in strains severely attenuated in their ability to grow in rice cells and that failed to produce spreading necrotic lesions on the leaf surface. Glutathione reductase, but not thioredoxin reductase or thioredoxin peroxidase, was shown to be required for neutralizing plant generated reactive oxygen species (ROS). The thioredoxin proteins, but not glutathione reductase, were shown to contribute to cell-wall integrity. Furthermore, glutathione and thioredoxin gene expression, under axenic growth conditions, was dependent on both the presence of glucose and the M. oryzae sugar/ NADPH sensor Tps1, thereby suggesting how glucose availability, NADPH production and antioxidation might be connected. Taken together, this work identifies components of the fungal glutathione and thioredoxin antioxidation systems as determinants of rice blast disease that act to facilitate biotrophic colonization of host cells by M. oryzae.
