21521743	A role for the cysteine-rich 10 kDa prolamin in protein body I formation in rice.	2011	Plant Cell Physiol	The rice prolamins consist of cysteine-rich 10 kDa (CysR10), 14 kDa (CysR14) and 16 kDa (CysR16) molecular species and a cysteine-poor 13 kDa (CysP13) polypeptide. These storage proteins form protein bodies (PBs) composed of single spherical intracisternal inclusions assembled within the lumen of the rough endoplasmic reticulum. Immunofluorescence and immunoelectron microscopy demonstrated that CysR10 and CysP13 were asymmetrically distributed within the PBs, with the former concentrated at the electron-dense center core region and the latter distributed mainly to the electron-lucent peripheral region. These results together with temporal expression data showed that the formation of prolamin-containing PB-I in the wild-type endosperm was initiated by the accumulation of CysR10 to form the center core. In mutants deficient for cysteine-rich prolamins, the typical PB-I structures containing the electron-dense center core were not observed, and instead were replaced by irregularly shaped, electron-lucent, hypertrophied PBs. Similar, deformed PBs were observed in a CysR10 RNA interference plant line. These results suggest that CysR10, through its formation of the central core and its possible interaction with other cysteine-rich prolamins, is required for tight packaging of the proteins into a compact spherical structure.
21205187	Rice phospholipase Dα is involved in salt tolerance by the mediation of H(+)-ATPase activity and transcription.	2011	J Integr Plant Biol	Phospholipase Dα (PLDα) is involved in plant response to salt stress, but the mechanisms remain unclear. We investigated rice PLDα (OsPLDα) localization and its effect on tonoplast (TP) and plasma membrane (PM) H(+)-ATPase activity and transcription in response to NaCl. When rice suspension-cultured cells were treated with 100 mM NaCl, PLDα activity in cell extracts showed a transient activation with a threefold increase at 1 h. The amount of OsPLDα protein decreased slightly in the cytosolic fractions, whereas it increased significantly in the TP after NaCl treatment. OsPLDα1 knockdown cells were developed using RNA interference (RNAi) methods. The increase in TP and PM H(+)-ATPase activity induced by NaCl was significantly inhibited in OsPLDα1-RNAi cells. Knockdown of OsPLDα1 prevented the NaCl-induced increase in the transcript level of OsVHA-A (encodes TP H(+)-ATPase) and OSA2 (encodes PM H(+)-ATPase), as well as OsNHX1 (encodes TP Na(+) /H(+) antiporter). The cells died more in OsPLDα1-RNAi mutant than in wild type when they were treated with NaCl. These results suggest that OsPLDα is involved in salt tolerance in rice through the mediation of H(+)-ATPase activity and transcription.
21645201	Discovery of polymorphisms in starch-related genes in rice germplasm by amplification of pooled DNA and deeply parallel sequencing.	2011	Plant Biotechnol J	High-throughput sequencing of pooled DNA was applied to polymorphism discovery in candidate genes involved in starch synthesis. This approach employed semi- to long-range PCR (LR-PCR) followed by next-generation sequencing technology. A total of 17 rice starch synthesis genes encoding seven classes of enzymes, including ADP-glucose pyrophosphorylase (AGPase), granule starch synthase (GBSS), soluble starch synthase (SS), starch branching enzyme (BE), starch debranching enzyme (DBE) and starch phosphorylase (SPHOL) and phosphate translocator (GPT1) from 233 genotypes were PCR amplified using semi- to long-range PCR. The amplification products were equimolarly pooled and sequenced using massively parallel sequencing technology (MPS). By detecting single nucleotide polymorphism (SNP)/Indels in both coding and noncoding areas of the genes, we identified genetic differences and characterized the SNP/Indel variation and distribution patterns among individual starch candidate genes. Approximately, 60.9 million reads were generated, of which 54.8 million (90%) mapped to the reference sequences. The average coverage rate ranged from 12,708 to 38,300 times for SSIIa and SSIIIb, respectively. SNPs and single/multiple-base Indels were analysed in a total assembled length of 116,403 bp. In total, 501 SNPs and 113 Indels were detected across the 17 starch-related loci. The ratio of synonymous to nonsynonymous SNPs (Ka/Ks) test indicated GBSSI and isoamylase 1 (ISA1) as the least diversified (most purified) and conservative genes as the studied populations have been through cycles of selection. This report demonstrates a useful strategy for screening germplasm by MPS to discover variants in a specific target group of genes.
21410288	The hypocholesterolemic activity of transgenic rice seed accumulating lactostatin, a bioactive peptide derived from bovine milk β-lactoglobulin.	2011	J Agric Food Chem	Lactostatin is a novel pentapeptide (IIAEK) derived from bovine milk β-lactoglobulin with greater hypocholesterolemic activity than β-sitosterol, the drug commonly used to treat hypercholesterolemia. We developed transgenic rice expressing lactostatin as a fusion protein with seed storage protein (SSP) glutelins under the control of three different endosperm-specific promoters. Lactostatin accumulated in transgenic rice seed at approximately 1.6 mg/g seeds (dry seeds) without any apparent influence on seed traits such as endogenous SSP expression levels or alterations in the intracellular structures of endosperm cells. Short-term (three day) oral administration of the glutelin fraction containing lactostatin (namely three times of 300 mg/kg body weight/day) extracted from transgenic rice seeds resulted in hypocholesterolemic activity in rats; namely, the serum low-density-lipoprotein (LDL) cholesterol level was significantly reduced accompanied by a significant increase in beneficial serum high-density-lipoprotein (HDL) cholesterol.
21527628	Overexpression of a Harpin-encoding gene hrf1 in rice enhances drought tolerance.	2011	J Exp Bot	Harpin proteins are well known as eliciters that induce multiple responses in plants, such as systemic acquired resistance, hypersensitive response, enhancement of growth, resistance to the green peach aphid, and tolerance to drought. Overexpression of Harpin-encoding genes enhances plant resistance to diseases in tobacco, rice, rape, and cotton; however, it is not yet known whether the expression of Harpin-encoding genes in vivo improves plant tolerance to abiotic stresses. The results of this study showed that overexpression of a Harpin-encoding gene hrf1 in rice increased drought tolerance through abscisic acid (ABA) signalling. hrf1- overexpression induces an increase in ABA content and promotes stomatal closure in rice. The hrf1 transgenic rice lines exhibited a significant increase in water retention ability, levels of free proline and soluble sugars, tolerance to oxidative stress, reactive oxygen species-scavenging ability, and expression levels of four stress-related genes, OsLEA3-1, OsP5CS, Mn-SOD, and NM_001074345, under drought stress. The study confirmed that hrf1 conferred enhanced tolerance to drought stress on transgenic crops. These results suggest that Harpins may offer new opportunities for generating drought resistance in other crops.
21490163	High-resolution secondary ion mass spectrometry reveals the contrasting subcellular distribution of arsenic and silicon in rice roots.	2011	Plant Physiol	Rice (Oryza sativa) takes up arsenite mainly through the silicic acid transport pathway. Understanding the uptake and sequestration of arsenic (As) into the rice plant is important for developing strategies to reduce As concentration in rice grain. In this study, the cellular and subcellular distributions of As and silicon (Si) in rice roots were investigated using high-pressure freezing, high-resolution secondary ion mass spectrometry, and transmission electron microscopy. Rice plants, both the lsi2 mutant lacking the Si/arsenite efflux transporter Lsi2 and its wild-type cultivar, with or without an iron plaque, were treated with arsenate or arsenite. The formation of iron plaque on the root surface resulted in strong accumulation of As and phosphorous on the epidermis. The lsi2 mutant showed stronger As accumulation in the endodermal vacuoles, where the Lsi2 transporter is located in the plasma membranes, than the wild-type line. As also accumulated in the vacuoles of some xylem parenchyma cells and in some pericycle cells, particularly in the wild-type mature root zone. Vacuolar accumulation of As is associated with sulfur, suggesting that As may be stored as arsenite-phytochelatin complexes. Si was localized in the cell walls of the endodermal cells with little apparent effect of the Lsi2 mutation on its distribution. This study reveals the vacuolar sequestration of As in rice roots and contrasting patterns of As and Si subcellular localization, despite both being transported across the plasma membranes by the same transporters.
21501886	Inoculation with Xanthomonas oryzae pv. oryzae induces thylakoid membrane association of Rubisco activase in Oryza meyeriana.	2011	J Plant Physiol	Oryza meyeriana is a wild species of rice with high resistance to Xanthomonas oryzae pv. oryzae (Xoo), but the resistance mechanism is poorly understood. Protein gel blot analysis and immuno-gold electron microscopy showed that Xoo infection induced an association of ribulose-1,5-bisphosphate carboxylase/oxygenase (Rubisco) activase (RCA) with the thylakoid membrane in O. meyeriana, which led to considerable decline in the initial activity and the activation state of Rubisco. In susceptible cultivated rice, RCA remained in the chloroplast stroma. RCA may play a role in resistance to Xoo in O. meyeriana that differs from its well-known role in activating Rubisco, perhaps by protecting the thylakoid membrane against damage from Xoo.
21596949	Leaf rolling controlled by the homeodomain leucine zipper class IV gene Roc5 in rice.	2011	Plant Physiol	Leaf rolling is considered an important agronomic trait in rice (Oryza sativa) breeding. To understand the molecular mechanism controlling leaf rolling, we screened a rice T-DNA insertion population and isolated the outcurved leaf1 (oul1) mutant showing abaxial leaf rolling. The phenotypes were caused by knockout of Rice outermost cell-specific gene5 (Roc5), an ortholog of the Arabidopsis (Arabidopsis thaliana) homeodomain leucine zipper class IV gene GLABRA2. Interestingly, overexpression of Roc5 led to adaxially rolled leaves, whereas cosuppression of Roc5 resulted in abaxial leaf rolling. Bulliform cell number and size increased in oul1 and Roc5 cosuppression plants but were reduced in Roc5-overexpressing lines. The data indicate that Roc5 negatively regulates bulliform cell fate and development. Gene expression profiling, quantitative polymerase chain reaction, and RNA interference (RNAi) analyses revealed that Protodermal Factor Like (PFL) was probably down-regulated in oul1. The mRNA level of PFL was increased in Roc5-overexpressing lines, and PFL-RNAi transgenic plants exhibit reversely rolling leaves by reason of increases of bulliform cell number and size, indicating that Roc5 may have a conserved function. These are, to our knowledge, the first functional data for a gene encoding a homeodomain leucine zipper class IV transcriptional factor in rice that modulates leaf rolling.
21274561	Visualisation of stromules in transgenic wheat expressing a plastid-targeted yellow fluorescent protein.	2011	Planta	Stromules are stroma-filled tubules that extend from the plastids in all multicellular plants examined to date. To facilitate the visualisation of stromules on different plastid types in various tissues of bread wheat (Triticum aestivum L.), a chimeric gene construct encoding enhanced yellow fluorescent protein (EYFP) targeted to plastids with the transit peptide of wheat granule-bound starch synthase I was introduced by Agrobacterium-mediated transformation. The gene construct was under the control of the rice Actin1 promoter, and EYFP fluorescence was detected in plastids in all cell types throughout the transgenic plants. Stromules were observed on all plastid types, although the stromule length and abundance varied markedly in different tissues. The longest stromules (up to 40 μm) were observed in epidermal cells of leaves, whereas only short beak-like stromules were observed on chloroplasts in mesophyll cells. Epidermal cells in leaves and roots contained the highest proportion of plastids with stromules, and stromules were also abundant on amyloplasts in the endosperm tissue of developing seeds. The general features of stromule morphology and distribution were similar to those shown previously for tobacco (Nicotiana tabacum L.) and arabidopsis (Arabidopsis thaliana (L.) Heynh.).
21638061	Cloning and characterization of a maize SnRK2 protein kinase gene confers enhanced salt tolerance in transgenic Arabidopsis.	2011	Plant Cell Rep	SnRK2 (sucrose non-fermenting 1-related protein kinases 2) represents a unique family of protein kinase in regulating signaling transduction in plants. Although the regulatory mechanisms of SnRK2 have been well demonstrated in Arabidopsis thaliana, their functions in maize are still unknown. In our study, we cloned an SnRK2 gene from maize, ZmSAPK8, which encoded a putative homolog of the rice SAPK8 protein. ZmSAPK8 had two copies in the maize genome and harbored eight introns in its coding region. We demonstrated that ZmSAPK8 expressed differentially in various organs of maize plants and was up-regulated by high-salinity and drought treatment. A green fluorescent protein (GFP)-tagged ZmSAPK8 showed subcellular localization in the cell membrane, cytoplasm and nucleus. In vitro kinase assays indicated that ZmSAPK8 preferred Mn(2+) to Mg(2+) as cofactor for phosphorylation, and Ser-182 and Thr-183 in activation loop was important for its activity. Heterologous overexpression of ZmSAPK8 in Arabidopsis could significantly strengthen tolerance to salt stress. Under salt treatment, ZmSAPK8-overexpressed transgenic plants exhibited higher germination rate and proline content, low electrolyte leakage and higher survival rate than wild type. Further analysis indicated that transgenic plants showed increased transcription of the stress-related genes, RD29A, RD29B, RAB18, ABI1, DREB2A and P5CS1, under high-salinity conditions. The results demonstrated that ZmSAPK8 was involved in diverse stress signal transduction. Moreover, no obvious adverse effects on growth and development in the ZmSAPK8-overexpressed transgenic plants implied that ZmSAPK8 was potentially useful in transgenic breeding to improve salt tolerance in crops.
21518249	Identification of a stable quantitative trait locus for percentage grains with white chalkiness in rice (Oryza sativa).	2011	J Integr Plant Biol	High chalkiness is a major problem in many rice-producing areas of the world, especially in hybrid rice (Oryza sativa L.) in China. We previously showed a major quantitative trait locus for the percentage of grains with white chalkiness (QTLqPGWC-8) in the interval G1149-R727 on chromosome 8 using a chromosome segment substitution line (CSSL). Here, we selected the line-CSSL50 harboring the QTLqPGWC-8 allele from the CSSLs derived from a cross between Asominori (as a recurrent parent) and IR24 (as a donor parent), which had higher percentage chalkiness, markedly different from that of Asominori. There were also significant differences in starch granules, appearance of amylose content (AAC) and milling qualities between Asominori and CSSL50, but not in grain size or thousand grain weight (TGW). The BC(4) F(2) and BC(4) F(3) populations from a cross between CSSL50 and Asominori were used for fine mapping of qPGWC-8. We narrowed down the location of this QTL to a 142 kb region between Indel markers 8G-7 and 8G-9. QTLqPGWC-8 accounted for 50.9% of the difference in PGWC between the parents. The markers tightly linked to qPGWC-8 should facilitate cloning of the gene underlying this QTL and will be of value for marker-assisted selection in breeding rice varieties with better grain quality.
21540434	BARREN STALK FASTIGIATE1 is an AT-hook protein required for the formation of maize ears.	2011	Plant Cell	Ears are the seed-bearing inflorescences of maize (Zea mays) plants and represent a crucial component of maize yield. The first step in the formation of ears is the initiation of axillary meristems in the axils of developing leaves. In the classic maize mutant barren stalk fastigiate1 (baf1), first discovered in the 1950s, ears either do not form or, if they do, are partially fused to the main stalk. We positionally cloned Baf1 and found that it encodes a transcriptional regulator containing an AT-hook DNA binding motif. Single coorthologs of Baf1 are found in syntenic regions of brachypodium (Brachypodium distachyon), rice (Oryza sativa), and sorghum (Sorghum bicolor), suggesting that the gene is likely present in all cereal species. Protein-protein interaction assays suggest that BAF1 is capable of forming homodimers and heterodimers with other members of the AT-hook family. Another transcriptional regulator required for ear initiation is the basic helix-loop-helix protein BARREN STALK1 (BA1). Genetic and expression analyses suggest that Baf1 is required to reach a threshold level of Ba1 expression for the initiation of maize ears. We propose that Baf1 functions in the demarcation of a boundary region essential for the specification of a stem cell niche.
21443632	A P450-centric view of plant evolution.	2011	Plant J	Being by far the largest family of enzymes to support plant metabolism, the cytochrome P450s (CYPs) constitute an excellent reporter of metabolism architecture and evolution. The huge superfamily of CYPs found in angiosperms is built on the successful evolution of 11 ancestral genes, with very different fates and progenies. Essential functions in the production of structural components (membrane sterols), light harvesting (carotenoids) or hormone biosynthesis kept some of them under purifying selection, limiting duplication and sub/neofunctionalization. One group (the CYP71 clan) after an early trigger to diversification, has kept growing, producing bursts of gene duplications at an accelerated rate. The CYP71 clan now represents more than half of all CYPs in higher plants. Such bursts of gene duplication are likely to contribute to adaptation to specific niches and to speciation. They also occur, although with lower frequency, in gene families under purifying selection. The CYP complement (CYPomes) of rice and the model grass weed Brachypodium distachyon have been compared to view evolution in a narrower time window. The results show that evolution of new functions in plant metabolism is a very long-term process. Comparative analysis of the plant CYPomes provides information on the successive steps required for the evolution of land plants, and points to several cases of convergent evolution in plant metabolism. It constitutes a very useful tool for spotting essential functions in plant metabolism and to guide investigations on gene function.
21493745	The rice RMR1 associates with a distinct prevacuolar compartment for the protein storage vacuole pathway.	2011	Mol Plant	Transport of vacuolar proteins from Golgi apparatus or trans-Golgi network (TGN) to vacuoles is a receptor-mediated process via an intermediate membrane-bound prevacuolar compartment (PVC) in plant cells. Both vacuolar sorting receptor (VSR) and receptor homology region-transmembrane domain-RING-H2 (RMR) proteins have been shown to function in transporting storage proteins to protein storage vacuole (PSV), but little is known about the nature of the PVC for the PSV pathway. Here, we use the rice RMR1 (OsRMR1) as a probe to study the PSV pathway in plants. Immunogold electron microscopy (EM) with specific OsRMR1 antibodies showed that OsRMR1 proteins were found in the Golgi apparatus, TGN, and a distinct organelle with characteristics of PVC in both rice culture cells and developing rice seeds, as well as the protein body type II (PBII) or PSV in developing rice seeds. This organelle, also found in both tobacco BY-2 and Arabidopsis suspension cultured cells, is morphologically distinct from the VSR-positive multivesicular lytic PVC or multivesicular body (MVB) and thus represent a PVC for the PSV pathway that we name storage PVC (sPVC). Further in vivo and in vitro interaction studies using truncated OsRMR1 proteins secreted into the culture media of transgenic BY-2 suspension cells demonstrated that OsRMR1 functions as a sorting receptor in transporting vicilin-like storage proteins.
21294842	Genetic analysis and fine mapping of a novel semidominant dwarfing gene LB4D in rice.	2011	J Integr Plant Biol	A dwarf mutant, designated LB4D, was obtained among the progeny of backcrosses to a wild rice introgression line. Genetic analysis of LB4D indicated that the dwarf phenotype was controlled by a single semidominant dwarfing gene, which was named LB4D. The mutants were categorized as dn-type dwarf mutants according to the pattern of internode reduction. In addition, gibberellin (GA) response tests showed that LB4D plants were neither deficient nor insensitive to GA. This study found that tiller formation by LB4D plants was decreased by 40% compared with the wild type, in contrast to other dominant dwarf mutants that have been identified, indicating that a different dwarfing mechanism might be involved in the LB4D dominant mutant. The reduction of plant height in F(1) plants ranged from 27.9% to 38.1% in different genetic backgrounds, showing that LB4D exerted a stronger dominant dwarfing effect. Using large F(2) and F(3) populations derived from a cross between heterozygous LB4D and the japonica cultivar Nipponbare, the LB4D gene was localized to a 46 kb region between the markers Indel 4 and Indel G on the short arm of chromosome 11, and four predicted genes were identified as candidates in the target region.
20978084	OsCAND1 is required for crown root emergence in rice.	2011	Mol Plant	Crown roots are main components of the fibrous root system and important for crops to anchor and absorb water and nutrition. To understand the molecular mechanisms of crown root formation, we isolated a rice mutant defective in crown root emergence designated as Oscand1 (named after the Arabidopsis homologous gene AtCAND1). The defect of visible crown root in the Oscand1 mutant is the result of cessation of the G2/M cell cycle transition in the crown root meristem. Map-based cloning revealed that OsCAND1 is a homolog of Arabidopsis CAND1. During crown root primordium development, the expression of OsCAND1 is confined to the root cap after the establishment of fundamental organization. The transgenic plants harboring DR5::GUS showed that auxin signaling in crown root tip is abnormal in the mutant. Exogenous auxin application can partially rescue the defect of crown root development in Oscand1. Taken together, these data show that OsCAND1 is involved in auxin signaling to maintain the G2/M cell cycle transition in crown root meristem and, consequently, the emergence of crown root. Our findings provide new information about the molecular regulation of the emergence of crown root in rice.
21502187	Identification of a cis-acting element of ART1, a C2H2-type zinc-finger transcription factor for aluminum tolerance in rice.	2011	Plant Physiol	Rice (Oryza sativa) is one of the most aluminum (Al)-tolerant species among small-grain cereals. Recent identification of a transcription factor AL RESISTANCE TRANSCRIPTION FACTOR1 (ART1) revealed that this high Al tolerance in rice is achieved by multiple genes involved in detoxification of Al at different cellular levels. ART1 is a C2H2-type zinc-finger transcription factor and regulates the expression of 31 genes in the downstream. In this study, we attempted to identify a cis-acting element of ART1. We used the promoter region of SENSITIVE TO AL RHIZOTOXICITY1, an Al tolerance gene in the downstream of ART1. With the help of gel-shift assay, we were able to identify the cis-acting element as GGN(T/g/a/C)V(C/A/g)S(C/G). This element was found in the promoter region of 29 genes among 31 ART1-regulated genes. To confirm this cis-acting element in vivo, we transiently introduced this element one or five times tandemly repeated sequence with 35S minimal promoter and green fluorescent protein reporter together with or without ART1 gene in the tobacco (Nicotiana tabacum) mesophyll protoplasts. The results showed that the expression of green fluorescent protein reporter responded to ART1 expression. Furthermore, the expression increased with repetition of the cis-acting element. Our results indicate that the five nucleotides identified are the target DNA-binding sequence of ART1.
