24550897	Suppression of cell wall-related genes associated with stunting of Oryza glaberrima infected with Rice tungro spherical virus.	2014	Front Microbiol	Rice tungro disease is a complex disease caused by the interaction between Rice tungro bacilliform virus and Rice tungro spherical virus (RTSV). RTSV alone does not cause recognizable symptoms in most Asian rice (Oryza sativa) plants, whereas some African rice (O. glaberrima) plants were found to become stunted by RTSV. Stunting of rice plants by virus infections usually accompanies the suppression of various cell wall-related genes. The expression of cell wall-related genes was examined in O. glaberrima and O. sativa infected with RTSV to see the relationship between the severity of stunting and the suppression of cell wall-related genes by RTSV. The heights of four accessions of O. glaberrima were found to decline by 14-34% at 28 days post-inoculation (dpi) with RTSV, whereas the height reduction of O. sativa plants by RTSV was not significant. RTSV accumulated more in O. glaberrima plants than in O. sativa plants, but the level of RTSV accumulation was not correlated with the degree of height reduction among the four accessions of O. glaberrima. Examination for expression of genes for cellulose synthase A5 (CESA5) and A6 (CESA6), cellulose synthase-like A9 (CSLA9) and C7, and α-expansin 1 (expansin 1) and 15 precursors in O. glaberrima and O. sativa plants between 7 and 28 dpi with RTSV showed that the genes such as those for CESA5, CESA6, CSLA9, and expansin 1were more significantly suppressed in stunted plants of O. glaberrima at 14 dpi with RTSV than in O. sativa, suggesting that stunting of O. glaberrima might be associated with these cell wall-related genes suppressed by RTSV. Examination for expression of these genes in O. sativa plants infected with other rice viruses in previous studies indicated that the suppression of the expansin 1 gene is likely to be a signature response commonly associated with virus-induced stunting of Oryza species. These results suggest that stunting of O. glaberrima by RTSV infection might be associated with the suppression of these cell wall-related genes at the early stage of infection with RTSV.
24275521	Phylogenetic analysis reveals conservation and diversification of micro RNA166 genes among diverse plant species.	2014	Genomics	Similar to the majority of the microRNAs, mature miR166s are derived from multiple members of MIR166 genes (precursors) and regulate various aspects of plant development by negatively regulating their target genes (Class III HD-ZIP). The evolutionary conservation or functional diversification of miRNA166 family members remains elusive. Here, we show the phylogenetic relationships among MIR166 precursor and mature sequences from three diverse model plant species. Despite strong conservation, some mature miR166 sequences, such as ppt-miR166m, have undergone sequence variation. Critical sequence variation in ppt-miR166m has led to functional diversification, as it targets non-HD-ZIPIII gene transcript (s). MIR166 precursor sequences have diverged in a lineage specific manner, and both precursors and mature osa-miR166i/j are highly conserved. Interestingly, polycistronic MIR166s were present in Physcomitrella and Oryza but not in Arabidopsis. The nature of cis-regulatory motifs on the upstream promoter sequences of MIR166 genes indicates their possible contribution to the functional variation observed among miR166 species.
24354293	Speciation without chromatography using selective hydride generation: inorganic arsenic in rice and samples of marine origin.	2014	Anal Chem	Because of the toxicity of inorganic arsenic (iAs), only iAs needs to be monitored in food and feedstuff. This demands the development of easy and quick analytical methods to screen large number of samples. This work focuses on hydride generation (HG) coupled with an ICPMS as an arsenic detector where the HG is added as a selective step to determine iAs in the gaseous phase while organically bound As remains in the solution. iAs forms volatile arsine species with high efficiency when treated with NaBH4 at acidic conditions, whereas most other organoarsenic compounds do not form any or only less volatile arsines. Additionally, using high concentrations of HCl further reduces the production of the less volatile arsines and iAs is almost exclusively formed, therefore enabling to measure iAs without a prior step of species separation using chromatography. Here, we coupled a commercially available HG system to an ICPMS and optimized for determination of iAs in rice and samples of marine origin using different acid concentrations, wet and dry plasma conditions, and different reaction gas modes. Comparing this method to conventional HPLC-ICPMS, no statistical difference in iAs concentration was found and comparable limits of detections were achieved using less than half the instrument time.
24674921	OsATG7 is required for autophagy-dependent lipid metabolism in rice postmeiotic anther development.	2014	Autophagy	In flowering plants, the tapetum, the innermost layer of the anther, provides both nutrient and lipid components to developing microspores, pollen grains, and the pollen coat. Though the programmed cell death of the tapetum is one of the most critical and sensitive steps for fertility and is affected by various environmental stresses, its regulatory mechanisms remain mostly unknown. Here we show that autophagy is required for the metabolic regulation and nutrient supply in anthers and that autophagic degradation within tapetum cells is essential for postmeiotic anther development in rice. Autophagosome-like structures and several vacuole-enclosed lipid bodies were observed in postmeiotic tapetum cells specifically at the uninucleate stage during pollen development, which were completely abolished in a retrotransposon-insertional OsATG7 (autophagy-related 7)-knockout mutant defective in autophagy, suggesting that autophagy is induced in tapetum cells. Surprisingly, the mutant showed complete sporophytic male sterility, failed to accumulate lipidic and starch components in pollen grains at the flowering stage, showed reduced pollen germination activity, and had limited anther dehiscence. Lipidomic analyses suggested impairment of editing of phosphatidylcholines and lipid desaturation in the mutant during pollen maturation. These results indicate a critical involvement of autophagy in a reproductive developmental process of rice, and shed light on the novel autophagy-mediated regulation of lipid metabolism in eukaryotic cells.
24595535	Enhanced production of reducing sugars from transgenic rice expressing exo-glucanase under the control of a senescence-inducible promoter.	2014	Transgenic Res	We generated transgenic rice plants that express EXG1 exo-glucanase under the control of a senescence-inducible promoter. When a GUS coding sequence was connected to a promoter region of STAY GREEN (SGR) gene of rice and introduced into rice, GUS activity was specifically observed along with senescence. When an EXG1 cDNA was connected to the SGR promoter and introduced into rice, higher cellulase activities were detected after senescence. The EXG1 transgenic plants showed enhanced enzymatic saccharification efficiencies after senescence, but no significant difference of saccharification efficiencies was observed before senescence. The saccharification efficiencies were correlated with the cellulase activities in the transgenic plants. The EXG1 transgenic plants showed neither morphological abnormality nor sterility, both of which were observed when EXG1 was constitutively overexpressed. These results indicate that expression of cell wall degrading enzymes such as cellulase by a senescence-inducible promoter is one of the ways to enhance the saccharification ability of cellulosic biomass without affecting plant growth for efficient production of biofuels.
24618677	Will climate change affect outbreak patterns of planthoppers in Bangladesh?	2014	PLoS One	Recently, planthoppers outbreaks have intensified across Asia resulting in heavy rice yield losses. The problem has been widely reported as being induced by insecticides while other factors such as global warming that could be potential drivers have been neglected. Here, we speculate that global warming may increase outbreak risk of brown planthopper (Nilaparvata lugens Stål.). We present data that demonstrate the relationship between climate variables (air temperature and precipitation) and the abundance of brown planthopper (BPH) during 1998-2007. Data show that BPH has become significantly more abundant in April over the 10-year period, but our data do not indicate that this is due to a change in climate, as no significant time trends in temperature and precipitation could be demonstrated. The abundance of BPH varied considerably between months within a year which is attributed to seasonal factors, including the availability of suitable host plants. On the other hand, the variation within months is attributed to fluctuations in monthly temperature and precipitation among years. The effects of these weather variables on BPH abundance were analyzed statistically by a general linear model. The statistical model shows that the expected effect of increasing temperatures is ambiguous and interacts with the amount of rainfall. According to the model, months or areas characterized by a climate that is either cold and dry or hot and wet are likely to experience higher levels of BPH due to climate change, whereas other combinations of temperature and rainfall may reduce the abundance of BPH. The analysis indicates that global warming may have contributed to the recent outbreaks of BPH in some rice growing areas of Asia, and that the severity of such outbreaks is likely to increase if climate change exaggerates. Our study highlights the need to consider climate change when designing strategies to manage planthoppers outbreaks.
24033343	Chromium stress response effect on signal transduction and expression of signaling genes in rice.	2014	Physiol Plant	Hexavalent chromium [Cr(VI)] is a non-essential metal for normal plants and is toxic to plants at high concentrations. However, signaling pathways and molecular mechanisms of its action on cell function and gene expression remain elusive. In this study, we found that Cr(VI) induced endogenous reactive oxygen species (ROS) generation and Ca(2+) accumulation and activated NADPH oxidase and calcium-dependent protein kinase. We investigated global transcriptional changes in rice roots by microarray analysis. Gene expression profiling indicated activation of abscisic acid-, ethylene- and jasmonic acid-mediated signaling and inactivation of gibberellic acid-related pathways in Cr(VI) stress-treated rice roots. Genes encoding signaling components such as the protein kinases domain of unknown function 26, receptor-like cytoplasmic kinase, LRK10-like kinase type 2 and protein phosphatase 2C, as well as transcription factors WRKY and apetala2/ethylene response factor were predominant during Cr(VI) stress. Genes involved in vesicle trafficking were subjected to functional characterization. Pretreating rice roots with a vesicle trafficking inhibitor, brefeldin A, effectively reduced Cr(VI)-induced ROS production. Suppression of the vesicle trafficking gene, Exo70, by virus-induced gene silencing strategies revealed that vesicle trafficking is required for mediation of Cr(VI)-induced ROS production. Taken together, these findings shed light on the molecular mechanisms in signaling pathways and transcriptional regulation in response to Cr stress in plants.
24507130	Carbofuran promotes biochemical changes in carp exposed to rice field and laboratory conditions.	2014	Ecotoxicol Environ Saf	Effects of carbofuran commercial formulation on oxidative stress parameters were studied in carps (Cyprinus carpio) exposed to 50µg/L for 7 and 30 days under rice field and laboratory conditions. Thiobarbituric acid reactive substance (TBARS) levels were increased in the brain of fish after 7 and 30 days under rice field and laboratory conditions. In the liver and muscle, TBARS levels increased after 7 and 30 days under laboratory conditions, whereas in rice field the levels increased only after 30 days. Protein carbonyl content in the liver increased after 7 and 30 days under both experimental conditions. Acetylcholinesterase (AChE) activity was decreased in the brain and muscle after 7 and 30 days under both experimental conditions evaluated. The superoxide dismutase (SOD) activity increased in the liver after 7 and 30 days under rice field condition, whereas under laboratory condition this enzyme increased only after 30 days. The catalase (CAT) activity in the liver decreased after 30 days under rice field condition, whereas no changes were observed under laboratory conditions. In rice field, glutathione S-transferase (GST) decreased after 7 days but increased after 30 days, whereas no change was observed in fish exposed to carbofuran under laboratory conditions. These results suggest that environmental relevant carbofuran concentrations may cause oxidative stress, affecting biochemical and enzymatic parameters on carps. Some parameters could be used as biomarkers to carbofuran exposure.
24520898	StoS, a hybrid histidine kinase sensor of Xanthomonas oryzae pv. oryzae, is activated by sensing low O₂ concentration and is involved in stress tolerance and virulence.	2014	Mol Plant Microbe Interact	Bacteria have two-component signal transduction systems (TCSTS), which are important devices for receiving various environmental signals. A TCSTS generally consists of a sensor histidine kinase (HK) and a response regulator (RR) that contains a receiver domain. There are also hybrid-type HK (HyHK) that comprise a HK with a receiver domain within one molecule. In this study, we show that the deletion mutant of a HyHK XOO_0635 (StoS) of Xanthomonas oryzae pv. oryzae, the causal agent of bacterial leaf blight of rice, had decreased stress tolerance to high osmolarity, sodium, and H₂O₂. Growth of the StoS mutant was delayed, and viability was lower than the wild type in medium and in rice leaves. We found that StoS regulates the expression of various genes including XOO_3715, XOO_0131, and stoS itself. A domain search revealed a PAS domain with a heme pocket in StoS, implying that the HyHK functions as an O₂ sensor. When the bacteria were incubated in low oxygen, the StoS-dependent expression of XOO_0131 and XOO_3715 became higher. Therefore, StoS is activated by sensing a low O2 concentration in its environs and is involved in gene expression for adapting to various stressful conditions.
24456138	Rice MtN3/saliva/SWEET gene family: Evolution, expression profiling, and sugar transport.	2014	J Integr Plant Biol	The rice MtN3/saliva/SWEET gene family consists of 21 paralogs. However, their functions in physiological processes are largely unknown, although at least three of the 21 paralogs are used by pathogenic bacteria to infect rice. Here, we report the evolutionary features, transcriptional characteristics, and putative functions in sugar transport of this gene family. The wild rice accessions in this study included those with AA, BB, CC, BBCC, CCDD, EE, and GG genomes, which appeared approximately 0.58-14.6 million years ago. The structures, chromosomal locations, phylogenetic relationships, and homologous distribution among the accessions suggest that the number of rice MtN3/saliva/SWEET paralogs gradually increased as the Oryza genus evolved, and one third of the paralogs may have originated recently. These paralogs are differentially expressed in vegetative and reproductive tissues, in the leaf senescence process, and in signaling dependent on gibberellic acid, cytokinin, or 1-naphthalene acetic acid (an analog of auxin), suggesting that they may be associated with multiple physiological processes. Four paralogs could transport galactose in yeast, which suggests that they may have a similar function in rice. These results will help to elucidate their roles and biochemical functions in rice development, adaptation to environment, host-pathogen interaction, and so forth.
24384682	Rice, bread, noodle and cereal intake and colorectal cancer in Japanese men and women: the Japan Public Health Center-based prospective Study (JPHC Study).	2014	Br J Cancer	BACKGROUND: Colorectal cancer (CRC) incidence rate increased rapidly in Japan between the 1950s and 1990s. We examined the association between rice intake and CRC risk in comparison with bread, noodles and cereal among Japanese adults enrolled in the Japan Public Health Center-based prospective Study.

METHODS: A total of 73,501 Japanese men and women were followed-up from 1995 to 1999 until the end of 2008 for an average of 11 years. During 801,937 person-years of follow-up, we identified 1276 incident cases of CRC. Hazard ratios (HRs) and 95% confidence intervals (95% CIs) of CRC for rice, noodle, bread and cereal intake were calculated by Cox proportional hazards model.

RESULTS: Overall, no significant association was observed for the highest quartile of rice intake compared with the lowest and the risk of CRC and its subsites in men (HR, 0.77; 95% CI, 0.56-1.07) and women (HR, 1.10; 95% CI, 0.71-1.68). However, a non-significant inverse trend was observed between rice intake and rectal cancer in men. No clear patterns of association were observed in bread, noodle and cereal intake.

CONCLUSION: Our findings suggest that the consumption of rice does not have a substantial impact on the risk of CRC in the Japanese population.
24389480	In vivo hair growth-promoting effect of rice bran extract prepared by supercritical carbon dioxide fluid.	2014	Biol Pharm Bull	The potential hair growth-promoting activity of rice bran supercritical CO2 extract (RB-SCE) and major components of RB-SCE, linoleic acid, policosanol, γ-oryzanol, and γ-tocotrienol, were evaluated with the histological morphology and mRNA expression levels of cell growth factors using real-time reverse transcriptase-polymerase chain reaction (PCR) in C57BL/6 mice. RB-SCE showed hair growth-promoting potential to a similar extent as 3% minoxidil, showing that the hair follicles were induced to be in the anagen stage. The numbers of the hair follicles were significantly increased. In addition, mRNA expression levels of vascular endothelial growth factor (VEGF), insulin-like growth factor-1 (IGF-1), and keratinocyte growth factor (KGF) were also significantly increased and that of transforming growth factor-β (TGF-β) decreased in RB-SCE-treated groups. Among the major components of RB-SCE, linoleic acid and γ-oryzanol induced the formation of hair follicles according to examination of histological morphology and mRNA expression levels of cell growth factors. In conclusion, our results demonstrate that RB-SCE, particularly linoleic acid and γ-oryzanol, promotes hair growth and suggests RB-SCE can be applied as hair loss treatment.
24533099	Transcriptome analysis of fat bodies from two brown planthopper (Nilaparvata lugens) populations with different virulence levels in rice.	2014	PLoS One	BACKGROUND: The brown planthopper (BPH), Nilaparvata lugens (Stål), one of the most serious rice insect pests in Asia, can quickly overcome rice resistance by evolving new virulent populations. The insect fat body plays essential roles in the life cycles of insects and in plant-insect interactions. However, whether differences in fat body transcriptomes exist between insect populations with different virulence levels and whether the transcriptomic differences are related to insect virulence remain largely unknown.

METHODOLOGY/PRINCIPAL FINDINGS: In this study, we performed transcriptome-wide analyses on the fat bodies of two BPH populations with different virulence levels in rice. The populations were derived from rice variety TN1 (TN1 population) and Mudgo (M population). In total, 33,776 and 32,332 unigenes from the fat bodies of TN1 and M populations, respectively, were generated using Illumina technology. Gene ontology annotations and Kyoto Encyclopedia of Genes and Genomes (KEGG) orthology classifications indicated that genes related to metabolism and immunity were significantly active in the fat bodies. In addition, a total of 339 unigenes showed homology to genes of yeast-like symbionts (YLSs) from 12 genera and endosymbiotic bacteria Wolbachia. A comparative analysis of the two transcriptomes generated 7,860 differentially expressed genes. GO annotations and enrichment analysis of KEGG pathways indicated these differentially expressed transcripts might be involved in metabolism and immunity. Finally, 105 differentially expressed genes from YLSs and Wolbachia were identified, genes which might be associated with the formation of different virulent populations.

CONCLUSIONS/SIGNIFICANCE: This study was the first to compare the fat-body transcriptomes of two BPH populations having different virulence traits and to find genes that may be related to this difference. Our findings provide a molecular resource for future investigations of fat bodies and will be useful in examining the interactions between the fat body and virulence variation in the BPH.
24433542	The karrikin response system of Arabidopsis.	2014	Plant J	Arabidopsis thaliana provides a powerful means to investigate the mode of action of karrikins, compounds produced during wildfires that stimulate germination of seeds of fire-following taxa. These studies have revealed close parallels between karrikin signalling and strigolactone signalling. The two perception systems employ similar mechanisms involving closely related α/β-fold hydrolases (KAI2 and AtD14) and a common F-box protein (MAX2). However, karrikins and strigolactones may be distinguished from each other and elicit different responses. The karrikin response requires a newly discovered protein (SMAX1), a homologue of rice protein D53 that is required for the strigolactone response. Mutants defective in the response to karrikins have seeds with increased dormancy, altered seedling photomorphogenesis and modified leaf shape. As the karrikin and strigolactone response mechanisms are so similar, it is speculated that the endogenous signalling compound for the KAI2 system may be a specific strigolactone. However, new results show that the proposed endogenous signalling compound is not produced by the known strigolactone biosynthesis pathway via carlactone. Structural studies of KAI2 protein and its interaction with karrikins and strigolactone analogues provide some insight into possible protein-ligand interactions, but are hampered by lack of knowledge of the endogenous ligand. The KAI2 system appears to be present throughout angiosperms, implying a fundamentally important function in plant biology.
24586663	Phylogeny and molecular evolution analysis of PIN-FORMED 1 in angiosperm.	2014	PLoS One	PIN-FORMED 1 (PIN1) is an important secondary transporter and determines the direction of intercellular auxin flow. As PIN1 performs the conserved function of auxin transport, it is expected that the sequence and structure of PIN1 is conserved. Therefore, we hypothesized that PIN1 evolve under pervasive purifying selection in the protein-coding sequences in angiosperm. To test this hypothesis, we performed detailed evolutionary analyses of 67 PIN1 sequences from 35 angiosperm species. We found that the PIN1 sequences are highly conserved within their transmembrane regions, part of their hydrophilic regions. We also found that there are two or more PIN1 copies in some of these angiosperm species. PIN1 sequences from Poaceae and Brassicaceae are representative of the modern clade. We identified 12 highly conserved motifs and a significant number of family-specific sites within these motifs. One family-specific site within Motif 11 shows a different residue between monocots and dicots, and is functionally critical for the polarity of PIN1. Likewise, the function of PIN1 appears to be different between monocots and dicots since the phenotype associated with PIN1 overexpression is opposite between Arabidopsis and rice. The evolution of angiosperm PIN1 protein-coding sequences appears to have been primarily driven by purifying selection, but traces of positive selection associated with sequences from certain families also seem to be present. We verified this observation by calculating the numbers of non-synonymous and synonymous changes on each branch of a phylogenetic tree. Our results indicate that the evolution of angiosperm PIN1 sequences involve strong purifying selection. In addition, our results suggest that the conserved sequences of PIN1 derive from a combination of the family-specific site variations and conserved motifs during their unique evolutionary processes, which is critical for the functional integrity and stability of these auxin transporters, especially in new species. Finally, functional difference of PIN1 is likely to be present in angiosperm because the positive selection is occurred in one branch of Poaceae.
