21220781	Spatial expression and regulation of rice high-affinity nitrate transporters by nitrogen and carbon status.	2011	J Exp Bot	The high affinity nitrate transport system (HATS) plays an important role in rice nitrogen acquisition because, even under flooded anaerobic cultivation when NH(4)(+) dominates, significant nitrification occurs on the root surface. In the rice genome, four NRT2 and two NAR2 genes encoding HATS components have been identified. One gene OsNRT2.3 was mRNA spliced into OsNRT2.3a and OsNRT2.3b and OsNAR2.1 interacts with OsNRT2.1/2.2 and OsNRT2.3a to provide nitrate uptake. Using promoter-GUS reporter plants and semi-quantitative RT-PCR analyses, it was observed that OsNAR2.1 was expressed mainly in the root epidermal cells, differently from the five OsNRT2 genes. OsNAR2.1, OsNRT2.1, OsNRT2.2, and OsNRT2.3a were up-regulated by nitrate and suppressed by NH(4)(+) and high root temperature (37 °C). Expression of all these genes was increased by light or external sugar supply. Root transcripts of OsNRT2.3b and OsNRT2.4 were much less abundant and not affected by temperature. Expression of OsNRT2.3b was insensitive to the form of N supply. Expression of OsNRT2.4 responded to changes in auxin supply unlike all the other NRT2 genes. A region from position -311 to -1, relative to the translation start site in the promoter region of OsNAR2.1, was found to contain the cis-element(s) necessary for the nitrate-, but not light- and sugar-dependent activation. However, it was difficult to define a conserved cis-element in the promoters of the nitrate-regulated OsNRT2/OsNAR2 genes. The results imply distinct physiological functions for each OsNRT2 transporter, and differential regulation pathways by N and C status.
21178395	Rice WNK1 is regulated by abiotic stress and involved in internal circadian rhythm.	2011	Plant Signal Behav	In Mammalian system the WNK (with no lysine kinase) serine-threonine protein kinase gene family is suggested to be involved in regulating ion homeostasis and other pathophysiological processes including cancer, hypertension and renal ion transport. In plant system the information about WNK genes is very poor. However, WNK-like genes have also been identified in plants, including ten in Arabidopsis, designated AtWNK1-AtWNK10. Here we report the cloning and characterization of a homologue of AtWNK1 gene from Oryza sativa indica cultivar Pusa Basmati-1 rice and designated as OsWNK1. The specific feature of this gene is lysine residue in kinase subdomain II, which is essential for the coordination of ATP in the active center and conserved among all other kinases, is absent. OsWNK1 was found to respond differentially under various abiotic stresses like cold, heat, salt, drought. OsWNK1 gene showed rhythmic expression profile under diurnal and circadian conditions at the transcription level. Our data indicates that OsWNK1 in rice might play a role in abiotic stress tolerance and that it is involved in internal rhythm.
21148627	A major QTL, Ghd8, plays pleiotropic roles in regulating grain productivity, plant height, and heading date in rice.	2011	Mol Plant	Rice yield and heading date are two distinct traits controlled by quantitative trait loci (QTLs). The dissection of molecular mechanisms underlying rice yield traits is important for developing high-yielding rice varieties. Here, we report the cloning and characterization of Ghd8, a major QTL with pleiotropic effects on grain yield, heading date, and plant height. Two sets of near isogenic line populations were developed for the cloning of Ghd8. Ghd8 was narrowed down to a 20-kb region containing two putative genes, of which one encodes the OsHAP3 subunit of a CCAAT-box binding protein (HAP complex); this gene was regarded as the Ghd8 candidate. A complementary test confirmed the identity and pleiotropic effects of the gene; interestingly, the genetic effect of Ghd8 was dependent on its genetic background. By regulating Ehd1, RFT1, and Hd3a, Ghd8 delayed flowering under long-day conditions, but promoted flowering under short-day conditions. Ghd8 up-regulated MOC1, a key gene controlling tillering and branching; this increased the number of tillers, primary and secondary branches, thus producing 50% more grains per plant. The ectopic expression of Ghd8 in Arabidopsis caused early flowering by 10 d-a situation similar to the one observed by its homolog AtHAP3b, when compared to wild-type under long-day conditions; these findings indicate the conserved function of Ghd8 and AtHAP3b in flowering in Arabidopsis. Our results demonstrated the important roles of Ghd8 in rice yield formation and flowering, as well as its opposite functions in flowering between rice and Arabidopsis under long-day conditions.
21296585	A stress-associated protein containing A20/AN1 zing-finger domains expressed in Medicago truncatula seeds.	2011	Plant Physiol Biochem	MtSAP1 (Medicago truncatula stress-associated protein 1) was revealed as a down-regulated gene by suppressive subtractive hybridization between two mRNA populations of embryo axes harvested before and after radicle emergence. MtSAP1 is the first gene encoding a SAP with A20 and AN1 zinc-finger domains characterized in M. truncatula. MtSAP1 protein shares 54% and 62% homology with AtSAP7 (Arabidopsis thaliana) and OsiSAP8 (Oryza sativa) respectively, with in particular a strong homology in the A20 and AN1 conserved domains. MtSAP1 gene expression increased in the embryos during the acquisition of tolerance to desiccation, reached its maximum in dry seed and decreased dramatically during the first hours of imbibition. Abiotic stresses (cold and hypoxia), abscisic acid and desiccation treatments induced MtSAP1 gene expression and protein accumulation in embryo axis, while mild drought stress did not affect significantly its expression. This profile of expression along with the presence of anaerobic response elements and ABRE sequences in the upstream region of the gene is consistent with a role of MtSAP1 in the tolerance of low oxygen availability and desiccation during late stages of seed maturation. Silencing of MtSAP1 by RNA interference (RNAi) showed that the function of the encoded protein is required for adequate accumulation of storage globulin proteins, vicilin and legumin, and for the development of embryos able to achieve successful germination.
21451255	Overexpression of the mitogen-activated protein kinase gene OsMAPK33 enhances sensitivity to salt stress in rice (Oryza sativa L.).	2011	J Biosci	Mitogen-activated protein kinases (MAPK) signalling cascades are activated by extracellular stimuli such as environmental stresses and pathogens in higher eukaryotic plants. To know more about MAPK signalling in plants, aMAPK cDNA clone, OsMAPK33, was isolated from rice. The gene is mainly induced by drought stress. In phylogenetic analysis, OsMAPK33 (Os02g0148100) showed approximately 47-93% identity at the amino acid level with other plant MAPKs. It was found to exhibit organ-specific expression with relatively higher expression in leaves as compared with roots or stems, and to exist as a single copy in the rice genome. To investigate the biological functions of OsMAPK33 in rice MAPK signalling, transgenic rice plants that either overexpressed or suppressed OsMAPK33 were made. Under dehydration conditions, the suppressed lines showed lower osmotic potential compared with that of wild-type plants, suggesting a role of OsMAPK33 in osmotic homeostasis. Nonetheless, the suppressed lines did not display any significant difference in drought tolerance compared with their wild-type plants. With increased salinity, there was still no difference in salt tolerance between OsMAPK33-suppressed lines and their wild-type plants. However, the overexpressing lines showed greater reduction in biomass accumulation and higher sodium uptake into cells, resulting in a lower K+/Na+ ratio inside the cell than that in the wild-type plants and OsMAPK33-suppressed lines. These results suggest that OsMAPK33 could play a negative role in salt tolerance through unfavourable ion homeostasis. Gene expression profiling of OsMAPK33 transgenic lines through rice DNA chip analysis showed that OsMAPK33 altered expression of genes involved in ion transport. Further characterization of downstream components will elucidate various biological functions of this novel rice MAPK.
21127026	Physiological, genetic, and molecular characterization of a high-Cd-accumulating rice cultivar, Jarjan.	2011	J Exp Bot	Cadmium (Cd) in rice is a major source of Cd intake for people on a staple rice diet. The mechanisms underlying Cd accumulation in rice plant are still poorly understood. Here, we characterized the physiology and genetics of Cd transport in a high-Cd-accumulating cultivar (Jarjan) of rice (Oryza sativa). Jarjan showed 5- to 34-fold higher Cd accumulation in the shoots and grains than the cultivar Nipponbare, when it was grown in either a non-Cd-contaminated or a Cd-contaminated soil. A short-term uptake experiment showed no significant difference in Cd uptake by the roots between the two cultivars. However, Jarjan translocated 49% of the total Cd taken up to the shoots, whereas Nipponbare retained most of the Cd in the roots. In both concentration- and time-dependent experiments, Jarjan showed a superior capacity for root-to-shoot translocation of Cd. These results indicate that the high-Cd-accumulation phenotype in Jarjan results from efficient translocation of Cd from roots to shoots. Genetic analysis using an F(2) population derived from Jarjan and Nipponbare revealed that plants showing high- and low-Cd-accumulation phenotypes segregated in a 1:3 ratio, indicating that high accumulation in Jarjan is controlled by a single recessive gene. Furthermore, we isolated OsHMA3, a gene encoding a tonoplast-localized Cd transporter from Jarjan. The OsHMA3 protein was localized in all roots cells, but the sequence has a mutation leading to loss of function. Therefore, failure to sequester Cd into the root vacuoles by OsHMA3 is probably responsible for high Cd accumulation in Jarjan.
21266036	ZINC-INDUCED FACILITATOR-LIKE family in plants: lineage-specific expansion in monocotyledons and conserved genomic and expression features among rice (Oryza sativa) paralogs.	2011	BMC Plant Biol	BACKGROUND: Duplications are very common in the evolution of plant genomes, explaining the high number of members in plant gene families. New genes born after duplication can undergo pseudogenization, neofunctionalization or subfunctionalization. Rice is a model for functional genomics research, an important crop for human nutrition and a target for biofortification. Increased zinc and iron content in the rice grain could be achieved by manipulation of metal transporters. Here, we describe the ZINC-INDUCED FACILITATOR-LIKE (ZIFL) gene family in plants, and characterize the genomic structure and expression of rice paralogs, which are highly affected by segmental duplication.

RESULTS: Sequences of sixty-eight ZIFL genes, from nine plant species, were comparatively analyzed. Although related to MSF_1 proteins, ZIFL protein sequences consistently grouped separately. Specific ZIFL sequence signatures were identified. Monocots harbor a larger number of ZIFL genes in their genomes than dicots, probably a result of a lineage-specific expansion. The rice ZIFL paralogs were named OsZIFL1 to OsZIFL13 and characterized. The genomic organization of the rice ZIFL genes seems to be highly influenced by segmental and tandem duplications and concerted evolution, as rice genome contains five highly similar ZIFL gene pairs. Most rice ZIFL promoters are enriched for the core sequence of the Fe-deficiency-related box IDE1. Gene expression analyses of different plant organs, growth stages and treatments, both from our qPCR data and from microarray databases, revealed that the duplicated ZIFL gene pairs are mostly co-expressed. Transcripts of OsZIFL4, OsZIFL5, OsZIFL7, and OsZIFL12 accumulate in response to Zn-excess and Fe-deficiency in roots, two stresses with partially overlapping responses.

CONCLUSIONS: We suggest that ZIFL genes have different evolutionary histories in monocot and dicot lineages. In rice, concerted evolution affected ZIFL duplicated genes, possibly maintaining similar expression patterns between pairs. The enrichment for IDE1 boxes in rice ZIFL gene promoters suggests a role in Zn-excess and Fe-deficiency up-regulation of ZIFL transcripts. Moreover, this is the first description of the ZIFL gene family in plants and the basis for functional studies on this family, which may play important roles in Zn and Fe homeostasis in plants.
15879704	Characterization of an abiotic stress-inducible dehydrin gene, OsDhn1, in rice (Oryza sativa L.).	2005	Mol Cells	A full-length 1.1 kb cDNA, designated Oryza sativa Dehydrin 1 (OsDhn1), was isolated from the seed coat of rice. The deduced protein is hydrophilic and has three K-type and one S-type motifs (SK3-type), indicating that OsDhn1 belongs to the acidic dehydrin family, which includes wheat WCOR410 and Arabidopsis COR47. Expression of OsDhn1 was strongly induced by low temperature as well as by drought. Induction of OsDhn1 by cold stress was clearcut in the roots of seedlings and the epidermis of palea and lemma. OsDhn1 was also up-regulated in UBI::CBF1/DREB1b transgenic plants indicating that it is regulated by the CBF/DREB stress signaling pathway.
16267395	Characterization and transcriptional expression of the alpha-expansin gene family in rice.	2005	Mol Cells	The rice genome contains at least 28 EXPA (alpha-expansin) genes. We have obtained near full-length cDNAs from the previously uncharacterized genes. Analysis of these newly identified clones together with the 12 identified earlier showed that the EXPA genes contain up to two introns and encode proteins of 240 to 291 amino acid residues. The EXPA proteins contain three conserved motifs: eight cysteine residues at the N-terminus, four tryptophan residues at the C-terminus, and a histidine-phenylalanine-aspartate motif in the central region. EXPA proteins could be divided into six groups based on their sequence similarity. Most were strongly induced in two-day-old seedlings and in the roots of one-week-old plants. However, only 14 genes were expressed in the aboveground organs, and their patterns were quite diverse. Transcript levels of EXPA7, 14, 15, 18, 21, and 29 were greater in stems, while EXPA2, 4, 5, 6, and 16 were highly expressed in both stem and sheath but not in leaf blade. EXPA1 is leaf blade-preferential, and EXP9 is leaf sheath-preferential. Most of the root-expressed genes were more strongly expressed in the dividing zone. However, the Group 2 EXPA genes were also strongly expressed in both mature and dividing zones, while EXPA9 was preferentially expressed in the elongation zone. Fourteen EXPA genes were expressed in developing panicles, with some being expressed during most developmental stages, others only as the panicles matured. These diverse expression patterns of EXPA genes suggest that in general they have distinct roles in plant growth and development.
15604683	Nomenclature for members of the expansin superfamily of genes and proteins.	2004	Plant Mol Biol	
21868603	Hybrid male sterility in rice is due to epistatic interactions with a pollen killer locus.	2011	Genetics	In intraspecific crosses between cultivated rice (Oryza sativa) subspecies indica and japonica, the hybrid male sterility gene S24 causes the selective abortion of male gametes carrying the japonica allele (S24-j) via an allelic interaction in the heterozygous hybrids. In this study, we first examined whether male sterility is due solely to the single locus S24. An analysis of near-isogenic lines (NIL-F(1)) showed different phenotypes for S24 in different genetic backgrounds. The S24 heterozygote with the japonica genetic background showed male semisterility, but no sterility was found in heterozygotes with the indica background. This result indicates that S24 is regulated epistatically. A QTL analysis of a BC(2)F(1) population revealed a novel sterility locus that interacts with S24 and is found on rice chromosome 2. The locus was named Epistatic Factor for S24 (EFS). Further genetic analyses revealed that S24 causes male sterility when in combination with the homozygous japonica EFS allele (efs-j). The results suggest that efs-j is a recessive sporophytic allele, while the indica allele (EFS-i) can dominantly counteract the pollen sterility caused by S24 heterozygosity. In summary, our results demonstrate that an additional epistatic locus is an essential element in the hybrid sterility caused by allelic interaction at a single locus in rice. This finding provides a significant contribution to our understanding of the complex molecular mechanisms underlying hybrid sterility and microsporogenesis.
21749035	Characterization of the transgenic rice event TT51-1 and construction of a reference plasmid.	2011	J Agric Food Chem	Transgenic rice TT51-1 (BT63) is an insect resistant strain that was granted for safety certificate in China in 2009. This study characterizes the transgenic event TT51-1 using a GenomeWalker strategy. The organization of the transgenes indicated that the transgenes on two plasmids, pFHBT1 and pGL2RC7, had been integrated at the same locus. The sequence of the event TT51-1 spanned 8725 bp, including a truncated Cry1Ab/Ac cassette, an intact Cry1Ab/Ac cassette, two Amp gene segments, and an Hph gene segment. The 5' and 3' plant flanking sequences were isolated and used to locate the transgenes to chromosome 10 in TT51-1. The isolated TT51-1 fragment and a fragment of the rice PLD gene were integrated into a plasmid vector, to create plasmid pK-TT51 as a calibrator for detecting rice containing TT51-1. Analysis of unknown samples indicated that the reference plasmid was a reliable alternative to TT51-1 genomic DNA.
22077667	The half-size ABC transporters STR1 and STR2 are indispensable for mycorrhizal arbuscule formation in rice.	2012	Plant J	The central structure of the symbiotic association between plants and arbuscular mycorrhizal (AM) fungi is the fungal arbuscule that delivers minerals to the plant. Our earlier transcriptome analyses identified two half-size ABCG transporters that displayed enhanced mRNA levels in mycorrhizal roots. We now show specific transcript accumulation in arbusculated cells of both genes during symbiosis. Presently, arbuscule-relevant factors from monocotyledons have not been reported. Mutation of either of the Oryza sativa (rice) ABCG transporters blocked arbuscule growth of different AM fungi at a small and stunted stage, recapitulating the phenotype of Medicago truncatula stunted arbuscule 1 and 2 (str1 and str2) mutants that are deficient in homologous ABCG genes. This phenotypic resemblance and phylogenetic analysis suggest functional conservation of STR1 and STR2 across the angiosperms. Malnutrition of the fungus underlying limited arbuscular growth was excluded by the absence of complementation of the str1 phenotype by wild-type nurse plants. Furthermore, plant AM signaling was found to be intact, as arbuscule-induced marker transcript accumulation was not affected in str1 mutants. Strigolactones have previously been hypothesized to operate as intracellular hyphal branching signals and possible substrates of STR1 and STR2. However, full arbuscule development in the strigolactone biosynthesis mutants d10 and d17 suggested strigolactones to be unlikely substrates of STR1/STR2. Interestingly, rice STR1 is associated with a cis-natural antisense transcript (antiSTR1). Analogous to STR1 and STR2, at the root cortex level, the antiSTR1 transcript is specifically detected in arbusculated cells, suggesting unexpected modes of STR1 regulation in rice.
16541127	Molecular and functional characterization of sulfiredoxin homologs from higher plants.	2006	Cell Res	By reducing cysteine-sulfinic acid in oxidized peroxiredoxin, sulfiredoxin (Srx) plays an important role in oxidation stress resistance in yeast and human cells. Here, we report the first molecular and functional characterization of Srx homolog from higher plants. Bioinformatic analysis revealed the presence of potential Srx encoding sequences in both monocot and dicot plant species. Putative plant Srx proteins exhibited significant identities to their orthologs from yeast and human, and contained the conserved signature sequence and residues essential for catalysis. However, unlike yeast and human orthologs, plant Srxs were all predicted to possess chloroplast transit peptide in their primary structure. The Srx proteins from Arabidopsis and rice (designated as AtSrx and OsSrx, respectively) complemented functional deficiency of Srx in the SRX1 deletion yeast cells. A GFP fusion protein of AtSrx was targeted to chloroplast in Arabidopsis mesophyll protoplast. AtSrx transcription occurred in both vegetative and reproductive organs, and the highest transcript level was detected in leaves. Under oxidation stress, AtSrx transcript level was substantially increased, which paralleled with enhanced transcription of 2-Cys peroxiredoxins that have been found essential in maintaining chloroplast redox balance. In addition to oxidation stress, osmotic/water deficit or cold treatments also raised AtSrx transcript level. Consistent with above findings, the knock-out mutant of AtSrx was significantly more susceptible to oxidation stress than wild type Arabidopsis plant. Taken together, the results of this work indicate the existence of functional Srx homolog in higher plants that is essential for plants to cope with oxidation stress.
22019783	Natural variation in GS5 plays an important role in regulating grain size and yield in rice.	2011	Nat Genet	Increasing crop yield is one of the most important goals of plant science research. Grain size is a major determinant of grain yield in cereals and is a target trait for both domestication and artificial breeding(1). We showed that the quantitative trait locus (QTL) GS5 in rice controls grain size by regulating grain width, filling and weight. GS5 encodes a putative serine carboxypeptidase and functions as a positive regulator of grain size, such that higher expression of GS5 is correlated with larger grain size. Sequencing of the promoter region in 51 rice accessions from a wide geographic range identified three haplotypes that seem to be associated with grain width. The results suggest that natural variation in GS5 contributes to grain size diversity in rice and may be useful in improving yield in rice and, potentially, other crops(2).
22080596	Regulation of compound leaf development in Medicago truncatula by fused compound leaf1, a class M KNOX gene.	2011	Plant Cell	Medicago truncatula is a legume species belonging to the inverted repeat lacking clade (IRLC) with trifoliolate compound leaves. However, the regulatory mechanisms underlying development of trifoliolate leaves in legumes remain largely unknown. Here, we report isolation and characterization of fused compound leaf1 (fcl1) mutants of M. truncatula. Phenotypic analysis suggests that FCL1 plays a positive role in boundary separation and proximal-distal axis development of compound leaves. Map-based cloning indicates that FCL1 encodes a class M KNOX protein that harbors the MEINOX domain but lacks the homeodomain. Yeast two-hybrid assays show that FCL1 interacts with a subset of Arabidopsis thaliana BEL1-like proteins with slightly different substrate specificities from the Arabidopsis homolog KNATM-B. Double mutant analyses with M. truncatula single leaflet1 (sgl1) and palmate-like pentafoliata1 (palm1) leaf mutants show that fcl1 is epistatic to palm1 and sgl1 is epistatic to fcl1 in terms of leaf complexity and that SGL1 and FCL1 act additively and are required for petiole development. Previous studies have shown that the canonical KNOX proteins are not involved in compound leaf development in IRLC legumes. The identification of FCL1 supports the role of a truncated KNOX protein in compound leaf development in M. truncatula.
20082138	Molecular characterization of the Arginine decarboxylase gene family in rice.	2010	Transgenic Res	Arginine decarboxylase (ADC) is a key enzyme in plants that converts arginine into putrescine, an important mediator of abiotic stress tolerance. Adc genes have been isolated from a number of dicotyledonous plants but the oat and rice Adc genes are the only representatives of monocotyledonous species described thus far. Rice has a small family of Adc genes, and OsAdc1 expression has been shown to fluctuate under drought and chilling stress. We identified and characterized a second rice Adc gene (OsAdc2) which encodes a 629-amino-acid protein with a predicted molecular mass of 67 kDa. An unusual feature of the OsAdc2 gene is the presence of an intron and a short upstream open reading frame in the 5'-UTR. Sequence comparisons showed that OsAdc2 is more closely related to the oat Adc gene than to OsAdc1 or to its dicot homologs, and mRNA analysis showed that the two rice genes are also differently regulated. Whereas OsAdc1 is expressed in leaf, root and stem, OsAdc2 expression is restricted to stem tissue. Protein expression was investigated with specific antibodies against ADC1 and ADC2, corroborating the mRNA data. We discuss the expression profiles of OsAdc1 and OsAdc2 and potential functions for the two corresponding proteins.
