21760907	Altered levels of histone deacetylase OsHDT1 affect differential gene expression patterns in hybrid rice.	2011	PLoS One	Hybrids between different inbred varieties display novel patterns of gene expression resulted from parental variation in allelic nucleotide sequences. To study the function of chromatin regulators in hybrid gene expression, the histone deacetylase gene OsHDT1 whose expression displayed a circadian rhythm was over-expressed or inactivated by RNAi in an elite rice parent. Increased OsHDT1 expression did not affect plant growth in the parent but led to early flowering in the hybrid. Nonadditive up-regulation of key flowering time genes was found to be related to flowering time of the hybrid. Over-expression of OsHDT1 repressed the nonadditive expression of the key flowering repressors in the hybrid (i.e. OsGI and Hd1) inducing early flowering. Analysis of histone acetylation suggested that OsHDT1 over-expression might promote deacetylation on OsGI and Hd1 chromatin during the peak expression phase. High throughput differential gene expression analysis revealed that altered OsHDT1 levels affected nonadditive expression of many genes in the hybrid. These data demonstrate that nonadditive gene expression was involved in flowering time control in the hybrid rice and that OsHDT1 level was important for nonadditive or differential expression of many genes including the flowering time genes, suggesting that OsHDT1 may be involved in epigenetic control of parental genome interaction for differential gene expression.
21796369	Functional analysis of OsPUT1, a rice polyamine uptake transporter.	2012	Planta	Polyamines are nitrogenous compounds found in all eukaryotic and prokaryotic cells and absolutely essential for cell viability. In plants, they regulate several growth and developmental processes and the levels of polyamines are also correlated with the plant responses to various biotic and abiotic stresses. In plant cells, polyamines are synthesized in plastids and cytosol. This biosynthetic compartmentation indicates that the specific transporters are essential to transport polyamines between the cellular compartments. In the present study, a phylogenetic analysis was used to identify candidate polyamine transporters in rice. A full-length cDNA rice clone AK068055 was heterologously expressed in the Saccharomyces cerevisiae spermidine uptake mutant, agp2∆. Radiological uptake and competitive inhibition studies with putrescine indicated that rice gene encodes a protein that functioned as a spermidine-preferential transporter. In competition experiments with several amino acids at 25-fold higher levels than spermidine, only methionine, asparagine, and glutamine were effective in reducing uptake of spermidine to 60% of control rates. Based on those observations, this rice gene was named polyamine uptake transporter 1 (OsPUT1). Tissue-specific expression of OsPUT1 by semiquantitative RT-PCR showed that the gene was expressed in all tissues except seeds and roots. Transient expression assays in onion epidermal cells and rice protoplasts failed to localize to a cellular compartment. The characterization of the first plant polyamine transporter sets the stage for a systems approach that can be used to build a model to fully define how the biosynthesis, degradation, and transport of polyamines in plants mediate developmental and biotic responses.
21777365	Over-expression of OsPIN2 leads to increased tiller numbers, angle and shorter plant height through suppression of OsLAZY1.	2012	Plant Biotechnol J	Crop architecture parameters such as tiller number, angle and plant height are important agronomic traits that have been considered for breeding programmes. Auxin distribution within the plant has long been recognized to alter architecture. The rice (Oryza sativa L.) genome contains 12 putative PIN genes encoding auxin efflux transporters, including four PIN1 and one PIN2 genes. Here, we report that over-expression of OsPIN2 through a transgenic approach in rice (Japonica cv. Nipponbare) led to a shorter plant height, more tillers and a larger tiller angle when compared with wild type (WT). The expression patterns of the auxin reporter DR5::GUS and quantification of auxin distribution showed that OsPIN2 over-expression increased auxin transport from the shoot to the root-shoot junction, resulting in a non-tissue-specific accumulation of more free auxin at the root-shoot junction relative to WT. Over-expression of OsPIN2 enhanced auxin transport from shoots to roots, but did not alter the polar auxin pattern in the roots. Transgenic plants were less sensitive to N-1-naphthylphthalamic acid, an auxin transport inhibitor, than WT in their root growth. OsPIN2-over-expressing plants had suppressed the expression of a gravitropism-related gene OsLazy1 in the shoots, but unaltered expression of OsPIN1b and OsTAC1, which were reported as tiller angle controllers in rice. The data suggest that OsPIN2 has a distinct auxin-dependent regulation pathway together with OsPIN1b and OsTAC1 controlling rice shoot architecture. Altering OsPIN2 expression by genetic transformation can be directly used for modifying rice architecture.
21734114	Functional analysis of two isoforms of leaf-type ferredoxin-NADP(+)-oxidoreductase in rice using the heterologous expression system of Arabidopsis.	2011	Plant Physiol	Ferredoxin-NADP(+)-oxidoreductase (FNR) mediates electron transfer between ferredoxin (Fd) and NADP(+); therefore, it is a key enzyme that provides the reducing power used in the Calvin cycle. Other than FNR, nitrite reductase, sulfite reductase, glutamate synthase, and Fd-thioredoxin reductase also accept electrons from Fd, an electron carrier protein in the stroma. Therefore, the regulation of electron partitioning in the chloroplast is important for photosynthesis and other metabolic pathways. The regulatory mechanism of electron partitioning, however, remains to be elucidated. We found, by taking advantage of a gain-of-function approach, that expression of two rice (Oryza sativa) full-length cDNAs of leaf-type FNRs (OsLFNR1 and OsLFNR2) led to altered chlorophyll fluorescence and growth in Arabidopsis (Arabidopsis thaliana) and rice. We revealed that overexpression of the OsLFNR1 and OsLFNR2 full-length cDNAs resulted in distinct phenotypes despite the high sequence similarity between them. Expression of OsLFNR1 affected the nitrogen assimilation pathway without inhibition of photosynthesis under normal conditions. On the other hand, OsLFNR2 expression led to the impairment of photosynthetic linear electron transport as well as Fd-dependent cyclic electron flow around photosystem I. The endogenous protein level of OsLFNR was found to be suppressed in both OsLFNR1- and OsLFNR2-overexpressing rice plants, leading to changes in the stoichiometry of the two LFNR isoforms within the thylakoid and soluble fractions. Thus, we propose that the stoichiometry of two LFNR isoforms plays an important role in electron partitioning between carbon fixation and nitrogen assimilation.
21804028	Molecular distinction in genetic regulation of nonphotochemical quenching in rice.	2011	Proc Natl Acad Sci U S A	Nonphotochemical quenching (NPQ) regulates energy conversion in photosystem II and protects plants from photoinhibition. Here we analyze NPQ capacity in a number of rice cultivars. NPQ was strongly induced under medium and high light intensities in rice leaves. Japonica cultivars generally showed higher NPQ capacities than Indica cultivars when we measured a rice core collection. We mapped NPQ regulator and identified a locus (qNPQ1-2) that seems to be responsible for the difference in NPQ capacity between Indica and Japonica. One of the two rice PsbS homologues (OsPsbS1) was found within the qNPQ1-2 region. PsbS protein was not accumulated in the leaf blade of the mutant harboring transferred DNA insertion in OsPsbS1. NPQ capacity increased as OsPsbS1 expression increased in a series of transgenic lines ectopically expressing OsPsbS1 in an Indica cultivar. Indica cultivars lack a 2.7-kb region at the point 0.4 kb upstream of the OsPsbS1 gene, suggesting evolutionary discrimination of this gene.
21756975	Rice OsERG3 encodes an unusual small C2-domain protein containing a Ca(2+)-binding module but lacking phospholipid-binding properties.	2011	Biochim Biophys Acta	BACKGROUND: The C2 domain is a Ca(2+)/phospholipid-binding motif found in many proteins involved in signal transduction or membrane trafficking. OsERG3 is a homolog of OsERG1, a gene encoding a small C2-domain protein in rice.

METHODS: OsERG3 Ca(2+)-binding and phospholipid-binding assays were carried out using (3)H-labeled phospholipid liposomes and a (45)Ca(2+) overlay assay, respectively. Cytosolic expression of OsERG3 was investigated by Western blot analysis and the OsERG3::smGFP transient expression assay.

RESULTS: OsERG3 transcript levels were greatly enhanced by treatment with a fungal elicitor and Ca(2+)-ionophore. OsERG3 protein proved unable to interact with phospholipids regardless of the presence or absence of Ca(2+) ions. Nonetheless, OsERG3 displayed calcium-binding activity in an in vitro(45)Ca(2+)-binding assay, a property not observed with OsERG1. The cytosolic location of OsERG3 was not altered by the presence of fungal elicitor or Ca(2+)-ionophore.

CONCLUSIONS: OsERG3 encodes a small C2-domain protein consisting of a single C2 domain. OsERG3 binds Ca(2+) ions but not phospholipids. OsERG3 is a cytosolic soluble protein. The OsERG3 gene may play a role in signaling pathway involving Ca(2+) ions.

GENERAL SIGNIFICANCE: The data demonstrate that OsERG3 is an unusual small C2-domain protein containing a Ca(2+)-binding module but lacking phospholipid-binding properties.
21804566	14-3-3 proteins act as intracellular receptors for rice Hd3a florigen.	2011	Nature	'Florigen' was proposed 75 years ago to be synthesized in the leaf and transported to the shoot apex, where it induces flowering. Only recently have genetic and biochemical studies established that florigen is encoded by FLOWERING LOCUS T (FT), a gene that is universally conserved in higher plants. Nonetheless, the exact function of florigen during floral induction remains poorly understood and receptors for florigen have not been identified. Here we show that the rice FT homologue Hd3a interacts with 14-3-3 proteins in the apical cells of shoots, yielding a complex that translocates to the nucleus and binds to the Oryza sativa (Os)FD1 transcription factor, a rice homologue of Arabidopsis thaliana FD. The resultant ternary 'florigen activation complex' (FAC) induces transcription of OsMADS15, a homologue of A. thaliana APETALA1 (AP1), which leads to flowering. We have determined the 2.4 Å crystal structure of rice FAC, which provides a mechanistic basis for florigen function in flowering. Our results indicate that 14-3-3 proteins act as intracellular receptors for florigen in shoot apical cells, and offer new approaches to manipulate flowering in various crops and trees.
21631533	Role of peroxidases in the compensation of cytosolic ascorbate peroxidase knockdown in rice plants under abiotic stress.	2011	Plant Cell Environ	Current studies, particularly in Arabidopsis, have demonstrated that mutants deficient in cytosolic ascorbate peroxidases (APXs) are susceptible to the oxidative damage induced by abiotic stress. In contrast, we demonstrate here that rice mutants double silenced for cytosolic APXs (APx1/2s) up-regulated other peroxidases, making the mutants able to cope with abiotic stress, such as salt, heat, high light and methyl viologen, similar to non-transformed (NT) plants. The APx1/2s mutants exhibited an altered redox homeostasis, as indicated by increased levels of H₂O₂ and ascorbate and glutathione redox states. Both mutant and NT plants exhibited similar photosynthesis (CO₂) assimilation and photochemical efficiency) under both normal and stress conditions. Overall, the antioxidative compensatory mechanism displayed by the mutants was associated with increased expression of OsGpx genes, which resulted in higher glutathione peroxidase (GPX) activity in the cytosolic and chloroplastic fractions. The transcript levels of OsCatA and OsCatB and the activities of catalase (CAT) and guaiacol peroxidase (GPOD; type III peroxidases) were also up-regulated. None of the six studied isoforms of OsApx were up-regulated under normal growth conditions. Therefore, the deficiency in cytosolic APXs was effectively compensated for by up-regulation of other peroxidases. We propose that signalling mechanisms triggered in rice mutants could be distinct from those proposed for Arabidopsis.
21753117	OsPHF1 regulates the plasma membrane localization of low- and high-affinity inorganic phosphate transporters and determines inorganic phosphate uptake and translocation in rice.	2011	Plant Physiol	PHOSPHATE TRANSPORTER TRAFFIC FACILITATOR1 (PHF1) is known to regulate the plasma membrane localization of PHT1;1, a high-affinity inorganic phosphate (Pi) transporter in Arabidopsis (Arabidopsis thaliana). OsPHF1, a rice (Oryza sativa) gene homologous to AtPHF1, was isolated and found to regulate the localization of both low- and high-affinity Pi transporters to the plasma membrane. Three OsPHF1 allelic mutants carrying one-point mutations at the fifth WD-repeat motif and two at the transmembrane helix, respectively, showed arsenate resistance and severely reduced Pi accumulation. The data indicate that mutation of OsPHF1 results in the endoplasmic reticulum retention of the low-affinity Pi transporter OsPT2 and high-affinity Pi transporter OsPT8. Mutation of OsPHF1 also reduced Pi accumulation in plants exhibiting excessive shoot Pi accumulation due to the overexpression of OsPHR2. However, the transcript level of OsPHF1 itself is not controlled by OsPHR2. Overexpression of OsPHF1 increased Pi accumulation in both roots and shoots in a solution culture with Pi-supplied condition. These results indicate that the role of OsPHF1 is unique in the localization of both low- and high-affinity Pi transporters on the plasma membrane in rice and determines Pi uptake and translocation in rice. The similar function of PHF1 required to facilitate PHT1 transit through the endoplasmic reticulum between Arabidopsis and rice provides an example of expectations from what one would deduce from sequence comparisons to extend knowledge from Arabidopsis to crops.
21795261	Genome-wide identification, classification, and expression analysis of autophagy-associated gene homologues in rice (Oryza sativa L.).	2011	DNA Res	Autophagy is an intracellular degradation process for recycling macromolecules and organelles. It plays important roles in plant development and in response to nutritional demand, stress, and senescence. Organisms from yeast to plants contain many autophagy-associated genes (ATG). In this study, we found that a total of 33 ATG homologues exist in the rice [Oryza sativa L. (Os)] genome, which were classified into 13 ATG subfamilies. Six of them are alternatively spliced genes. Evolutional analysis showed that expansion of 10 OsATG homologues occurred via segmental duplication events and that the occurrence of these OsATG homologues within each subfamily was asynchronous. The Ka/Ks ratios suggested purifying selection for four duplicated OsATG homologues and positive selection for two. Calculating the dates of the duplication events indicated that all duplication events might have occurred after the origin of the grasses, from 21.43 to 66.77 million years ago. Semi-quantitative RT-PCR analysis and mining the digital expression database of rice showed that all 33 OsATG homologues could be detected in at least one cell type of the various tissues under normal or stress growth conditions, but their expression was tightly regulated. The 10 duplicated genes showed expression divergence. The expression of most OsATG homologues was regulated by at least one treatment, including hormones, abiotic and biotic stresses, and nutrient limitation. The identification of OsATG homologues showing constitutive expression or responses to environmental stimuli provides new insights for in-depth characterization of selected genes of importance in rice.
18980645	Systematic approaches to using the FOX hunting system to identify useful rice genes.	2009	Plant J	Ectopic gene expression, or the gain-of-function approach, has the advantage that once the function of a gene is known the gene can be transferred to many different plants by transformation. We previously reported a method, called FOX hunting, that involves ectopic expression of Arabidopsis full-length cDNAs in Arabidopsis to systematically generate gain-of-function mutants. This technology is most beneficial for generating a heterologous gene resource for analysis of useful plant gene functions. As an initial model we generated more than 23,000 independent Arabidopsis transgenic lines that expressed rice fl-cDNAs (Rice FOX Arabidopsis lines). The short generation time and rapid and efficient transformation frequency of Arabidopsis enabled the functions of the rice genes to be analyzed rapidly. We screened rice FOX Arabidopsis lines for alterations in morphology, photosynthesis, element accumulation, pigment accumulation, hormone profiles, secondary metabolites, pathogen resistance, salt tolerance, UV signaling, high light tolerance, and heat stress tolerance. Some of the mutant phenotypes displayed by rice FOX Arabidopsis lines resulted from the expression of rice genes that had no homologs in Arabidopsis. This result demonstrated that rice fl-cDNAs could be used to introduce new gene functions in Arabidopsis. Furthermore, these findings showed that rice gene function could be analyzed by employing Arabidopsis as a heterologous host. This technology provides a framework for the analysis of plant gene function in a heterologous host and of plant improvement by using heterologous gene resources.
19762423	A gene network for long-day flowering activates RFT1 encoding a mobile flowering signal in rice.	2009	Development	Although some genes that encode sensory or regulatory elements for photoperiodic flowering are conserved between the long-day (LD) plant Arabidopsis thaliana and the short-day (SD) plant rice, the gene networks that control rice flowering, and particularly flowering under LD conditions, are not well understood. We show here that RICE FLOWERING LOCUS T 1 (RFT1), the closest homolog to Heading date 3a (Hd3a), is a major floral activator under LD conditions. An RFT1:GFP fusion protein localized in the shoot apical meristem (SAM) under LD conditions, suggesting that RFT1 is a florigen gene in rice. Furthermore, mutants in OsMADS50, a rice ortholog of Arabidopsis SUPPRESOR OF OVEREXPRESSION OF CONSTANS 1 (SOC1) did not flower up to 300 days after sowing under LD conditions, indicating that OsMADS50, which acts upstream of RFT1, promotes flowering under LD conditions. We propose that both positive (OsMADS50 and Ehd1) and negative (Hd1, phyB and Ghd7) regulators of RFT1 form a gene network that regulates LD flowering in rice. Among these regulators, Ehd1, a rice-specific floral inducer, integrates multiple pathways to regulate RFT1, leading to flowering under appropriate photoperiod conditions. A rice ortholog of Arabidopsis APETALA1, OsMADS14, was expressed in the floral meristem in wild-type but not in RFT1 RNAi plants, suggesting that OsMADS14 is activated by RFT1 protein in the SAM after the transition to flowering. We have thus exposed a network of genes that regulate LD flowering in rice.
21853042	Characterization of the PRMT gene family in rice reveals conservation of arginine methylation.	2011	PLoS One	Post-translational methylation of arginine residues profoundly affects the structure and functions of protein and, hence, implicated in a myriad of essential cellular processes such as signal transduction, mRNA splicing and transcriptional regulation. Protein arginine methyltransferases (PRMTs), the enzymes catalyzing arginine methylation have been extensively studied in animals, yeast and, to some extent, in model plant Arabidopsis thaliana. Eight genes coding for the PRMTs were identified in Oryza sativa, previously. Here, we report that these genes show distinct expression patterns in various parts of the plant. In vivo targeting experiment demonstrated that GFP-tagged OsPRMT1, OsPRMT5 and OsPRMT10 were localized to both the cytoplasm and nucleus, whereas OsPRMT6a and OsPRMT6b were predominantly localized to the nucleus. OsPRMT1, OsPRMT4, OsPRMT5, OsPRMT6a, OsPRMT6b and OsPRMT10 exhibited in vitro arginine methyltransferase activity against myelin basic protein, glycine-arginine-rich domain of fibrillarin and calf thymus core histones. Furthermore, they depicted specificities for the arginine residues in histones H3 and H4 and were classified into type I and Type II PRMTs, based on the formation of type of dimethylarginine in the substrate proteins. The two homologs of OsPRMT6 showed direct interaction in vitro and further titrating different amounts of these proteins in the methyltransferase assay revealed that OsPRMT6a inhibits the methyltransferase activity of OsPRMT6b, probably, by the formation of heterodimer. The identification and characterization of PRMTs in rice suggests the conservation of arginine methylation in monocots and hold promise for gaining further insight into regulation of plant development.
21830109	Fine mapping a major QTL for flag leaf size and yield-related traits in rice.	2011	Theor Appl Genet	Leaf size is a major determinant of plant architecture and yield potential in crops. A previous study showed that the genomic region of chromosome 1 contains a major quantitative trait locus (QTL) for flag leaf size in a set of backcross recombinant inbred lines derived from two elite parental lines (Zhenshan 97 and 93-11). In the present study, the QTL (qFL1) was shown to explain a large proportion of the variation in flag leaf size (leaf length, width and area) in derived populations (BC(2)F(3) and BC(3)F(2)) in multiple environments. Using a large segregating population, we narrowed the location of qFL1 to a 31 kb region containing four predicted genes. Expression of one of these genes, OsFTL1, differed between leaves in near-isogenic lines carrying alleles of Zhenshan 97 and 93-11. qFL1 had a pleiotropic effect on flag leaf size and yield-related traits. Conditional QTL analysis of the derived population (BC(3)F(2)) supports the assertion that qFL1 is the QTL for flag leaf length and exhibits pleiotropy. Pyramiding of qFL1 with two known genes (GS3 and Wx) from 93-11 into Zhenshan 97 enlarged flag leaves, improved grain size and amylose content, and increased yield per plant, but slightly delayed heading date. These results provide a foundation for the functional characterization of the gene underlying the pleiotropic effects of qFL1 and for genetic improvement of the plant architecture and yield potential of rice.
21883553	A rice calcium-dependent protein kinase OsCPK12 oppositely modulates salt-stress tolerance and blast disease resistance.	2012	Plant J	Calcium-dependent protein kinases (CDPKs) regulate the downstream components in calcium signaling pathways. We investigated the effects of overexpression and disruption of an Oryza sativa (rice) CDPK (OsCPK12) on the plant's response to abiotic and biotic stresses. OsCPK12-overexpressing (OsCPK12-OX) plants exhibited increased tolerance to salt stress. The accumulation of hydrogen peroxide (H(2) O(2) ) in the leaves was less in OsCPK12-OX plants than in wild-type (WT) plants. Genes encoding reactive oxygen species (ROS) scavenging enzymes (OsAPx2 and OsAPx8) were more highly expressed in OsCPK12-OX plants than in WT plants, whereas the expression of the NADPH oxidase gene, OsrbohI, was decreased in OsCPK12-OX plants compared with WT plants. Conversely, a retrotransposon (Tos17) insertion mutant, oscpk12, and plants transformed with an OsCPK12 RNA interference (RNAi) construct were more sensitive to high salinity than were WT plants. The level of H(2) O(2) accumulation was greater in oscpk12 and OsCPK12 RNAi plants than in the WT. These results suggest that OsCPK12 promotes tolerance to salt stress by reducing the accumulation of ROS. We also observed that OsCPK12-OX seedlings had increased sensitivity to abscisic acid (ABA) and increased susceptibility to blast fungus, probably resulting from the repression of ROS production and/or the involvement of OsCPK12 in the ABA signaling pathway. Collectively, our results suggest that OsCPK12 functions in multiple signaling pathways, positively regulating salt tolerance and negatively modulating blast resistance.
