24603905	Transovarial transmission of a plant virus is mediated by vitellogenin of its insect vector.	2014	PLoS Pathog	Most plant viruses are transmitted by hemipteroid insects. Some viruses can be transmitted from female parent to offspring usually through eggs, but the mechanism of this transovarial transmission remains unclear. Rice stripe virus (RSV), a Tenuivirus, transmitted mainly by the small brown planthopper (Laodelphax striatellus), is also spread to the offspring through the eggs. Here, we used the RSV-planthopper system as a model to investigate the mechanism of transovarial transmission and demonstrated the central role of vitellogenin (Vg) of L. striatellus in the process of virus transmission into the eggs. Our data showed Vg can bind to pc3 in vivo and in vitro and colocalize in the germarium. RSV filamentous ribonucleoprotein particles (RNPs) only accumulated in the terminal filaments and pedicel areas prior to Vg expression and was not present in the germarium until Vg was expressed, where RSV RNPs and Vg had colocalized. Observations by immunoelectron microscopy (IEM) also indicated that these two proteins colocalized in nurse cells. Knockdown of Vg expression due to RNA interference resulted in inhibition of the invasion of ovarioles by RSV. Together, the data obtained indicated that RSV RNPs may enter the nurse cell of the germarium via endocytosis through binding with Vg. Finally, the virus enters the oocytes through nutritive cords, using the same route as for Vg transport. Our results show that the Vg of L. striatellus played a critical role in transovarial transmission of RSV and shows how viruses can use existing transovarial transportation systems in insect vectors for their own purposes.
24523924	Nonstructural protein NS4 of Rice Stripe Virus plays a critical role in viral spread in the body of vector insects.	2014	PLoS One	Rice stripe virus (RSV), a tenuivirus, is transmitted by small brown planthopper (SBPH) in a persistent-propagative manner. In this study, sequential infection of RSV in the internal organs of SBPH after ingestion of virus indicated that RSV initially infected the midgut epithelium, and then progressed to the visceral muscle tissues, through which RSV spread to the entire alimentary canal. Finally, RSV spread into the salivary glands and reproductive system. During viral infection, the nonstructural protein NS4 of RSV formed cytoplasmic inclusions in various tissues of viruliferous SBPH. We demonstrated that the ribonucleoprotein particles of RSV were closely associated with NS4-specific inclusions in the body of viruliferous SBPH through a direct interaction between NS4 and nucleoprotein of RSV. Moreover, the knockdown of NS4 expression due to RNA interference induced by dsRNA from NS4 gene significantly prevented the spread of RSV in the bodies of SBPHs without a significant effect on viral replication in continuous cell culture derived from SBPH. All these results suggest that the nonstructural protein NS4 of RSV plays a critical role in viral spread by the vector insects.
24300846	A growth inhibitory model with SO(x) influenced effective growth rate for estimation of algal biomass concentration under flue gas atmosphere.	2014	Bioresour Technol	A theoretical model for the prediction of biomass concentration under rice husk flue gas emission has been developed. The growth inhibitory model (GIM) considers the CO2 mass transfer rate, the critical SOx concentration and its role in pH-based inter-conversion of bicarbonate. The calibration and subsequent validation of the growth profile of Nannochloropsis limnetica at 2% and 10% (v/v) CO2 showed that the predicted values were consistent with the measured values, with r(2) being 0.96 and 0.98, respectively, and p<0.001 in both cases. The constants used in the GIM for the prediction of biomass have been justified using sensitivity analysis. GIM applicability was defined as ±30% of the calibrated flow rate (3.0 L min(-1)). This growth model can be applied to predict algal growth in photo-bioreactors treated with flue gas in the generation of biomass feed stock for biofuel production.
24664256	Expression patterns of conserved microRNAs in the male gametophyte of loblolly pine (Pinus taeda).	2014	Plant Reprod	MicroRNAs (miRNAs) are small RNAs that regulate genes involved in various aspects of plant development, but their presence and expression patterns in the male gametophytes of gymnosperms have not yet been established. Therefore, this study identified and compared the expression patterns of conserved miRNAs from two stages of the male gametophyte of loblolly pine (Pinus taeda), which are the mature (ungerminated) and germinated pollen. Microarray was used to identify conserved miRNAs that varied in expression between these two stages of the loblolly pine male gametophyte. Forty-seven conserved miRNAs showed significantly different expression levels between mature and germinated loblolly pine pollen. In particular, miRNAs representing 14 and 8 families were up- and down-regulated in germinated loblolly pine pollen, respectively. qRT-PCR was used to validate their expression patterns using representative miRNAs. Target genes and proteins were identified using psRNATarget program. Predicted targets of the 22 miRNA families belong mostly to classes of genes involved in defense/stress response, metabolism, regulation, and signaling. qRT-PCR was also used to validate the expression patterns of representative target genes. This study shows that conserved miRNAs are expressed in mature and germinated loblolly pine pollen. Many of these miRNAs are differentially expressed, which indicates that the two stages of the male gametophyte examined are regulated at the miRNA level. This study also expands our knowledge of the male gametophytes of seed plants by providing insights on some similarities and differences in the types and expression patterns of conserved miRNAs between loblolly pine with those of rice and Arabidopsis.
24442255	Production of poly-3-(hydroxybutyrate-co-hydroxyvalerate) by Haloferax mediterranei using rice-based ethanol stillage with simultaneous recovery and re-use of medium salts.	2014	Extremophiles	Haloferax mediterranei holds promise for competitive industrial-scale production of polyhydroxyalkanoate (PHA) because cheap carbon sources can be used thus lowering production costs. Although high salt concentration in production medium permits a non-sterile, low-cost process, salt disposal after process completion is a problem as current environmental standards do not allow total dissolved solids (TDS) above 2000 mg/l in discharge water. As the first objective of this work, the waste product of rice-based ethanol industry, stillage, was used for the production of PHA by H. mediterranei in shake flasks. Utilization of raw stillage led to 71 ± 2% (of dry cell weight) PHA accumulation and 16.42 ± 0.02 g/l PHA production. The product yield coefficient was 0.35 while 0.17 g/l h volumetric productivity was attained. Simultaneous reduction of BOD5 and COD values of stillage by 83% was accomplished. The PHA was isolated by osmotic lysis of cells, purification by sodium dodecyl sulfate and organic solvents. The biopolymer was identified as poly-3-(hydroxybutyrate-co-15.4 mol%-hydroxyvalerate) (PHBV). This first report on utilization of rice-based ethanol stillage for PHBV production by H. mediterranei is currently the most cost effective. As the second objective, directional properties of decanoic acid together with temperature dependence of water solubility in decanoic acid were applied for two-stage desalination of the spent stillage medium. We report for the first time, recovery and re-use of 96% of the medium salts for PHA production thus removing the major bottleneck in the potential application of H. mediterranei for industrial production of PHBV. Final discharge water had TDS content of 670 mg/l.
24518682	Predicting the function of 4-coumarate:CoA ligase (LJ4CL1) in Lonicera japonica.	2014	Int J Mol Sci	4-Coumarate:CoA ligases (4CLs) are a group of essential enzymes involved in the pathway of phenylpropanoid-derived compound metabolisms; however it is still difficult to identify orthologs and paralogs of these important enzymes just based on sequence similarity of the conserved domains. Using sequence data of 20 plant species from the public databases and sequences from Lonicera japonica, we define 1252 adenosine monophosphate (AMP)-dependent synthetase/ligase sequences and classify them into three phylogenetic clades. 4CLs are in one of the four subgroups, according to their partitioning, with known proteins characterized in A. thaliana and Oryza sativa. We also defined 184 non-redundant sequences that encode proteins containing the GEICIRG motif and the taxonomic distribution of these GEICIRG-containing proteins suggests unique catalytic activities in plants. We further analyzed their transcription levels in L. japonica and L. japonica. var. chinensis flowers and chose the highest expressed genes representing the subgroups for structure and binding site predictions. Coupled with liquid chromatography-mass spectrometry (LC-MS) analysis of the L. japonica flowers, the structural study on putative substrate binding amino acid residues, ferulate, and 4-coumaric acid of the conserved binding-site of LJ4CL1 leads to a conclusion that this highly expressed protein group in the flowers may process 4-coumarate that represents 90% of the known phenylpropanoid-derived compounds. The activity of purified crude LJ4CL1 protein was analyzed using 4-coumarate as template and high activity indicating that 4-coumarate is one of the substrates of LJ4CL1.
24243207	Sorghum genetic transformation by particle bombardment.	2014	Methods Mol Biol	Particle bombardment transformation describes the acceleration of high-velocity microparticles coated with exotic genes through the plant-protective cell walls, in order for the introduced genes to be integrated into the host genome. This technique has proven to be an effective and versatile approach towards plant genetic modification in preceding decades. Particle bombardment has been successfully applied to cereals including rice, maize, wheat, barley, and sorghum. Historically, sorghum has been considered as one of the most recalcitrant major crops with regard to successful genetic transformation; however, tremendous progress has been made in recent years. Transformation efficiency by particle bombardment has now improved from approximately 1 % to in excess of 20 % utilizing an optimized tissue culture and DNA delivery system. The protocol described in this chapter routinely generates transformants at 10-25 % efficiency within sorghum genotype Tx430. The process generally takes 11-16 weeks from initiation of immature embryos to planting of transformants. This protocol covers the operation of both the Bio-Rad PDS-1000/He System and particle inflow gun. Three factors are crucial to an efficient particle bombardment transformation system: (1) an efficient tissue culture system, (2) a highly efficient DNA delivery system, and (3) an effective selection strategy.
24548929	Degradation of lignocelluloses in rice straw by BMC-9, a composite microbial system.	2014	J Microbiol Biotechnol	To evaluate the potential utility of pretreatment of raw biomass with a complex microbial system, we investigated the degradation of rice straw by BMC-9, a lignocellulose decomposition strain obtained from a biogas slurry compost environment. The degradation characteristics and corresponding changes in the bacterial community were assessed. The results showed that rapid degradation occurred from day 0 to day 9, with a peak total biomass bacterium concentration of 3.3 × 10(8) copies/ml on day 1. The pH of the fermentation broth declined initially and then increased, and the mass of rice straw decreased steadily. The highest concentrations of volatile fatty acid contents (0.291 mg/l lactic acid, 0.31 mg/l formic acid, 1.93 mg/l acetic acid, and 0.73 mg/l propionic acid) as well as the highest xylanse activity (1.79 U/ml) and carboxymethyl cellulase activity (0.37 U/ml) occurred on day 9. The greatest diversity among the microbial community also occurred on day 9, with the presence of bacteria belonging to Clostridium sp., Bacillus sp., and Geobacillus sp. Together, our results indicate that BMC-9 has a strong ability to rapidly degrade the lignocelluloses of rice straw under relatively inexpensive conditions, and the optimum fermentation time is 9 days.
24445591	The modified rice αAmy8 promoter confers high-level foreign gene expression in a novel hypoxia-inducible expression system in transgenic rice seedlings.	2014	Plant Mol Biol	Expression of α-amylase genes in rice is induced not only by sugar starvation and gibberellin (GA) but also by O2 deficiency. Promoters of two rice α-amylase genes, αAmy3 and αAmy8, have been shown to direct high-level production of recombinant proteins in rice suspension cells and germinated seeds. In the present study, we modified the cis-acting DNA elements within the sugar/GA response complex (SRC/GARC) of αAmy8 promoter. We found that addition of a G box and duplicated TA box leads to high-level expression of αAmy8 SRC/GARC and significantly enhances αAmy8 promoter activity in transformed rice cells and germinated transgenic rice seeds. We also show that these modifications have drastically increased the activity of αAmy8 promoter in rice seedlings under hypoxia. Our results reveal that the G box and duplicated TA box may play important roles in stimulating promoter activity in response to hypoxia in rice. The modified αAmy8 promoter was used to produce the recombinant human epidermal growth factor (hEGF) in rice cells and hypoxic seedlings. We found that the bioactive recombinant hEGF are stably produced and yields are up to 1.8% of total soluble protein (TSP) in transformed rice cells. The expression level of synthetic hEGF containing preferred rice codon usage comprises up to 7.8% of TSP in hypoxic transgenic seedlings. Our studies reveal that the modified αAmy8 promoter can be applicable in establishing a novel expression system for the high-level production of foreign proteins in transgenic rice cells and seedlings under hypoxia.
24568490	Purple rice extract supplemented diet reduces DMH- induced aberrant crypt foci in the rat colon by inhibition of bacterial β-glucuronidase.	2014	Asian Pac J Cancer Prev	BACKGROUND: Purple rice has become a natural product of interest which is widely used for health promotion. This study investigated the preventive effect of purple rice extract (PRE) mixed diet on DMH initiation of colon carcinogenesis.

MATERIALS AND METHODS: Rats were fed with PRE mixed diet one week before injection of DMH (40 mg/kg of body weight once a week for 2 weeks). They were killed 12 hrs after a second DMH injection to measure the level of O6-methylguanine and xenobiotic metabolizing enzyme activities.

RESULTS: In rats that received PRE, guanine methylation was reduced in the colonic mucosa, but not in the liver, whereas PRE did not affect xenobiotic conjugation, with reference to glutathione-S-transferase or UDP-glucuronyl transferase. After 5 weeks, rats that received PRE with DMH injection had fewer ACF in the colon than those treated with DMH alone. Interestingly, a PRE mixed diet inhibited the activity of bacterial β-glucuronidase in rat feces, a critical enzyme for free methylazoxymethanol (MAM) release in the rat colon. These results indicated that purple rice extract inhibited β-glucuronidase activity in the colonic lumen, causing a reduction of MAM-induced colonic mucosa DNA methylation, leaded to decelerated formation of aberrant crypt foci in the rat colon.

CONCLUSIONS: The supplemented purple rice extract might thus prevent colon carcinogenesis by the alteration of the colonic environment, and thus could be further developed for neutraceutical products for colon cancer prevention.
24398116	Development of a microarray for two rice subspecies: characterization and validation of gene expression in rice tissues.	2014	BMC Res Notes	BACKGROUND: Rice is one of the major crop species in the world helping to sustain approximately half of the global population's diet especially in Asia. However, due to the impact of extreme climate change and global warming, rice crop production and yields may be adversely affected resulting in a world food crisis. Researchers have been keen to understand the effects of drought, temperature and other environmental stress factors on rice plant growth and development. Gene expression microarray technology represents a key strategy for the identification of genes and their associated expression patterns in response to stress. Here, we report on the development of the rice OneArray® microarray platform which is suitable for two major rice subspecies, japonica and indica.

RESULTS: The rice OneArray® 60-mer, oligonucleotide microarray consists of a total of 21,179 probes covering 20,806 genes of japonica and 13,683 genes of indica. Through a validation study, total RNA isolated from rice shoots and roots were used for comparison of gene expression profiles via microarray examination. The results were submitted to NCBI's Gene Expression Omnibus (GEO). Data can be found under the GEO accession number GSE50844 (http://www.ncbi.nlm.nih.gov/geo/query/acc.cgi?acc=GSE50844). A list of significantly differentially expressed genes was generated; 438 shoot-specific genes were identified among 3,138 up-regulated genes, and 463 root-specific genes were found among 3,845 down-regulated genes. GO enrichment analysis demonstrates these results are in agreement with the known physiological processes of the different organs/tissues. Furthermore, qRT-PCR validation was performed on 66 genes, and found to significantly correlate with the microarray results (R = 0.95, p < 0.001***).

CONCLUSION: The rice OneArray® 22 K microarray, the first rice microarray, covering both japonica and indica subspecies was designed and validated in a comprehensive study of gene expression in rice tissues. The rice OneArray® microarray platform revealed high specificity and sensitivity. Additional information for the rice OneArray® microarray can be found at http://www.phalanx.com.tw/index.php.
24472286	Small auxin upregulated RNA (SAUR) gene family in maize: identification, evolution, and its phylogenetic comparison with Arabidopsis, rice, and sorghum.	2014	J Integr Plant Biol	Small auxin-up RNAs (SAURs) are the early auxin-responsive genes represented by a large multigene family in plants. Here, we identified 79 SAUR gene family members from maize (Zea mays subsp. mays) by a reiterative database search and manual annotation. Phylogenetic analysis indicated that the SAUR proteins from Arabidopsis, rice, sorghum, and maize had divided into 16 groups. These genes were non-randomly distributed across the maize chromosomes, and segmental duplication and tandem duplication contributed to the expansion of the maize SAUR gene family. Synteny analysis established orthology relationships and functional linkages between SAUR genes in maize and sorghum genomes. We also found that the auxin-responsive elements were conserved in the upstream sequences of maize SAUR members. Selection analyses identified some significant site-specific constraints acted on most SAUR paralogs. Expression profiles based on microarray data have provided insights into the possible functional divergence among members of the SAUR gene family. Quantitative real-time PCR analysis indicated that some of the 10 randomly selected ZmSAUR genes could be induced at least in maize shoot or root tissue tested. The results reveal a comprehensive overview of the maize SAUR gene family and may pave the way for deciphering their function during plant development.
24688294	TaWRKY68 responses to biotic stresses are revealed by the orthologous genes from major cereals.	2014	Genet Mol Biol	WRKY transcription factors have been extensively characterized in the past 20 years, but in wheat, studies on WRKY genes and their function are lagging behind many other species. To explore the function of wheat WRKY genes, we identified a TaWRKY68 gene from a common wheat cultivar. It encodes a protein comprising 313 amino acids which harbors 19 conserved motifs or active sites. Gene expression patterns were determined by analyzing microarray data of TaWRKY68 in wheat and of orthologous genes from maize, rice and barley using Genevestigator. TaWRKY68 orthologs were identified and clustered using DELTA-BLAST and COBALT programs available at NCBI. The results showed that these genes, which are expressed in all tissues tested, had relatively higher levels in the roots and were up-regulated in response to biotic stresses. Bioinformatics results were confirmed by RT-PCR experiments using wheat plants infected by Agrobacterium tumefaciens and Blumeria graminis, or treated with Deoxynivalenol, a Fusarium graminearum-induced mycotoxin in wheat or barley. In summary, TaWRKY68 functions differ during plant developmental stages and might be representing a hub gene function in wheat responses to various biotic stresses. It was also found that including data from major cereal genes in the bioinformatics analysis gave more accurate and comprehensive predictions of wheat gene functions.
24556552	An efficient TALEN mutagenesis system in rice.	2014	Methods	Targeted gene mutagenesis is a powerful tool for elucidating gene function and facilitating genetic improvement in rice. TALENs (transcription activator-like effector nucleases), consisting of a custom TALE DNA binding domain fused to a nonspecific FokI cleavage domain, are one of the most efficient genome engineering methods developed to date. The technology of TALENs allows DNA double-strand breaks (DSBs) to be introduced into predetermined chromosomal loci. DSBs trigger DNA repair mechanisms and can result in loss of gene function by error-prone non-homologous end joining (NHEJ), or they can be exploited to modify gene function or activity by precise homologous recombination (HR). In this paper, we describe a detailed protocol for constructing TALEN expression vectors, assessing nuclease activities in vivo using rice protoplast-based assays, generating and introducing TALEN DNAs into embryogenic calluses of rice and identifying TALEN-generated mutations at targeted genomic sites. Using these methods, T0 rice plants resulting from TALEN mutagenesis can be produced within 4-5 months.
24405808	Beyond cleaved small RNA targets: unraveling the complexity of plant RNA degradome data.	2014	BMC Genomics	BACKGROUND: Degradation is essential for RNA maturation, turnover, and quality control. RNA degradome sequencing that integrates a modified 5'-rapid amplification of cDNA ends protocol with next-generation sequencing technologies is a high-throughput approach for profiling the 5'-end of uncapped RNA fragments on a genome-wide scale. The primary application of degradome sequencing has been to identify the truncated transcripts that result from endonucleolytic cleavage guided by microRNAs or small interfering RNAs. As many pathways are involved in RNA degradation, degradome data should contain other RNA species besides the cleavage remnants of small RNA targets. Nevertheless, no systematic approaches have been established to explore the hidden complexity of plant degradome.

RESULTS: Through analyzing Arabidopsis and rice RNA degradome data, we recovered 11 short motifs adjacent to predominant and abundant uncapped 5'-ends. Uncapped ends associated with several of these short motifs were more prevalent than those targeted by most miRNA families especially in the 3' untranslated region of transcripts. Through genome-wide analysis, five motifs showed preferential accumulation of uncapped 5'-ends at the same position in Arabidopsis and rice. Moreover, the association of uncapped 5'-ends with a CA-repeat motif and a motif recognized by Pumilio/Fem-3 mRNA binding factor (PUF) proteins was also found in non-plant species, suggesting that common mechanisms are present across species. Based on these motifs, potential sources of RNA ends that constitute degradome data were proposed and further examined. The 5'-end of small nucleolar RNAs could be precisely captured by degradome sequencing. Position-specific enrichment of uncapped 5'-ends was seen upstream of motifs recognized by several RNA binding proteins especially for the binding site of PUF proteins. False uncapped 5'-ends produced from capped transcripts through non-specific PCR amplification were common artifacts among degradome datasets.

CONCLUSIONS: The complexity of plant RNA degradome data revealed in this study may contribute to the alternative applications of degradome in RNA research.
