18718932	Comprehensive transcriptome analysis of phytohormone biosynthesis and signaling genes in microspore/pollen and tapetum of rice.	2008	Plant Cell Physiol	To investigate the involvement of phytohormones during rice microspore/pollen (MS/POL) development, endogenous levels of IAA, gibberellins (GAs), cytokinins (CKs) and abscisic acid (ABA) in the mature anther were analyzed. We also analyzed the global expression profiles of genes related to seven phytohormones, namely auxin, GAs, CKs, brassinosteroids, ethylene, ABA and jasmonic acids, in MS/POL and tapetum (TAP) using a 44K microarray combined with a laser microdissection technique (LM-array analysis). IAA and GA(4) accumulated in a much higher amount in the mature anther compared with the other tissues, while CKs and ABA did not. LM-array analysis revealed that sets of genes required for IAA and GA synthesis were coordinately expressed during the later stages of MS/POL development, suggesting that these genes are responsible for the massive accumulation of IAA and GA(4) in the mature anther. In contrast, genes for GA signaling were preferentially expressed during the early developmental stages of MS/POL and throughout TAP development, while their expression was down-regulated at the later stages of MS/POL development. In the case of auxin signaling genes, such mirror-imaged expression observed in GA synthesis and signaling genes was not observed. IAA receptor genes were mostly expressed during the late stages of MS/POL development, and various sets of AUX/IAA and ARF genes were expressed during the different stages of MS/POL or TAP development. Such cell type-specific expression profiles of phytohormone biosynthesis and signaling genes demonstrate the validity and importance of analyzing the expression of phytohormone-related genes in individual cell types independently of other cells/tissues.
20625906	OsSPO11-1 is essential for both homologous chromosome pairing and crossover formation in rice.	2010	Chromosoma	Spo11 is a homolog of a subunit of archaebacterial topoisomerase, which catalyzes DNA double-strand breaks and initiates homologous chromosome recombination. In the present study, we silenced the SPO11-1 gene in rice (Oryza sativa) using RNAi. Rice plants with loss-of-function of OsSPO11-1 have no apparent growth defects during vegetative development, but homologous chromosome pairing and recombination are significantly obstructed. Telomeres can be assembled as bouquet during the zygotene stage of the OsSPO11-1-deficient plants, just as that in wild type. Although the two axial-associated proteins, REC8 and PAIR2, are loaded onto the chromosomes, the depletion of PAIR2 from the chromosomes is much later than in wild type. The central element of the synaptonemal complex (SC), ZEP1, does not load onto the chromosomes normally, implying that SC formation is disturbed severely. The crossover protein, MER3, isn't efficiently assembled onto chromosomes and the lack of bivalent suggests that crossovers are also affected in the absence of OsSPO11-1. Thus, OsSPO11-1 is essential for both homologous chromosomes pairing and crossover formation during meiosis in rice.
19417775	Functional conservation of the meiotic genes SDS and RCK in male meiosis in the monocot rice.	2009	Cell Res	The Arabidopsis SDS (SOLO DANCERS) and RCK (ROCK-N-ROLLERS) genes are important for male meiosis, but it is still unknown whether they represent conserved functions in plants. We have performed phylogenetic analyses of SDS and RCK and their respective homologs, and identified their putative orthologs in poplar and rice. Quantitative real-time RT-PCR analysis indicated that rice SDS and RCK are expressed preferentially in young flowers, and transgenic RNAi rice lines with reduced expression of these genes exhibited normal vegetative development, but showed significantly reduced fertility with partially sterile flowers and defective pollens. SDS deficiency also caused a decrease in pollen amounts. Further cytological examination of male meiocytes revealed that the SDS deficiency led to defects in homolog interaction and bivalent formation in meiotic prophase I, and RCK deficiency resulted in defective meiotic crossover formation. These results indicate that rice SDS and RCK genes have similar functions to their Arabidopsis orthologs. Because rice and Arabidopsis, respectively, are members of monocots and eudicots, two largest groups of flowering plants, our results suggest that the functions of SDS and RCK are likely conserved in flowering plants.
19458115	Host and pathogen factors controlling the rice-Xanthomonas oryzae interaction.	2009	Plant Physiol	
20699274	TAL nucleases (TALNs): hybrid proteins composed of TAL effectors and FokI DNA-cleavage domain.	2011	Nucleic Acids Res	DNA double-strand breaks enhance homologous recombination in cells and have been exploited for targeted genome editing through use of engineered endonucleases. Here we report the creation and initial characterization of a group of rare-cutting, site-specific DNA nucleases produced by fusion of the restriction enzyme FokI endonuclease domain (FN) with the high-specificity DNA-binding domains of AvrXa7 and PthXo1. AvrXa7 and PthXo1 are members of the transcription activator-like (TAL) effector family whose central repeat units dictate target DNA recognition and can be modularly constructed to create novel DNA specificity. The hybrid FN-AvrXa7, AvrXa7-FN and PthXo1-FN proteins retain both recognition specificity for their target DNA (a 26 bp sequence for AvrXa7 and 24 bp for PthXo1) and the double-stranded DNA cleaving activity of FokI and, thus, are called TAL nucleases (TALNs). With all three TALNs, DNA is cleaved adjacent to the TAL-binding site under optimal conditions in vitro. When expressed in yeast, the TALNs promote DNA homologous recombination of a LacZ gene containing paired AvrXa7 or asymmetric AvrXa7/PthXo1 target sequences. Our results demonstrate the feasibility of creating a tool box of novel TALNs with potential for targeted genome modification in organisms lacking facile mechanisms for targeted gene knockout and homologous recombination.
16707243	Genome-wide analysis, evolutionary expansion, and expression of early auxin-responsive SAUR gene family in rice (Oryza sativa).	2006	Genomics	Small auxin-up RNAs (SAURs) are the early auxin-responsive genes represented by a large multigene family in plants. Here, we report the identification of 58 OsSAUR gene family members from rice (Oryza sativa japonica cv Nipponbare), the model monocot plant, by a reiterative database search and manual reannotation; 2 of these are pseudogenes. The coding sequences of OsSAURs do not possess any intron. Most of the predicted OsSAUR protein sequences harbor a putative nuclear localization signal at their N-terminus. Localized gene duplications appear to be the primary genetic event responsible for SAUR gene family expansion in rice. Interestingly, the duplication of OsSAURs was found to be associated with the chromosomal block duplication as well. The phylogenetic analysis revealed that the SAUR gene family expanded in rice and Arabidopsis due to species-specific expansion of the family in monocots and dicots. The auxin-responsive elements and downstream element are conserved in the upstream and downstream sequences, respectively, of OsSAURs. In addition to the 21 OsSAURs with full-length cDNA sequences and 20 with expressed sequence tags, gene expression analyses of at least 7 OsSAURs by RT-qPCR indicated that the majority of identified OsSAURs most likely are expressed in rice. The transcript abundance of the OsSAURs examined increased within a few minutes of exogenous auxin application with varying kinetics. The present study provides basic genomic information for the rice SAUR gene family and will pave the way for deciphering the precise role of SAURs in plant growth and development.
19490115	Transcript profiling reveals diverse roles of auxin-responsive genes during reproductive development and abiotic stress in rice.	2009	FEBS J	Auxin influences growth and development in plants by altering gene expression. Many auxin-responsive genes have been characterized in Arabidopsis in detail, but not in crop plants. Earlier, we reported the identification and characterization of the members of the GH3, Aux/IAA and SAUR gene families in rice. In this study, whole genome microarray analysis of auxin-responsive genes in rice was performed, with the aim of gaining some insight into the mechanism of auxin action. A comparison of expression profiles of untreated and auxin-treated rice seedlings identified 315 probe sets representing 298 (225 upregulated and 73 downregulated) unique genes as auxin-responsive. Functional categorization revealed that genes involved in various biological processes, including metabolism, transcription, signal transduction, and transport, are regulated by auxin. The expression profiles of auxin-responsive genes identified in this study and those of the members of the GH3, Aux/IAA, SAUR and ARF gene families were analyzed during various stages of vegetative and reproductive (panicle and seed) development by employing microarray analysis. Many of these genes are, indeed, expressed in a tissue-specific or developmental stage-specific manner, and the expression profiles of some of the representative genes were confirmed by real-time PCR. The differential expression of auxin-responsive genes during various stages of panicle and seed development implies their involvement in diverse developmental processes. Moreover, several auxin-responsive genes were differentially expressed under various abiotic stress conditions, indicating crosstalk between auxin and abiotic stress signaling.
11904292	Mlo, a modulator of plant defense and cell death, is a novel calmodulin-binding protein. Isolation and characterization of a rice Mlo homologue.	2002	J Biol Chem	Transient influx of Ca(2+) constitutes an early event in the signaling cascades that trigger plant defense responses. However, the downstream components of defense-associated Ca(2+) signaling are largely unknown. Because Ca(2+) signals are mediated by Ca(2+)-binding proteins, including calmodulin (CaM), identification and characterization of CaM-binding proteins elicited by pathogens should provide insights into the mechanism by which Ca(2+) regulates defense responses. In this study, we isolated a gene encoding rice Mlo (Oryza sativa Mlo; OsMlo) using a protein-protein interaction-based screening of a cDNA expression library constructed from pathogen-elicited rice suspension cells. OsMlo has a molecular mass of 62 kDa and shares 65% sequence identity and scaffold topology with barley Mlo, a heptahelical transmembrane protein known to function as a negative regulator of broad spectrum disease resistance and leaf cell death. By using gel overlay assays, we showed that OsMlo produced in Escherichia coli binds to soybean CaM isoform-1 (SCaM-1) in a Ca(2+)-dependent manner. We located a 20-amino acid CaM-binding domain (CaMBD) in the OsMlo C-terminal cytoplasmic tail that is necessary and sufficient for Ca(2+)-dependent CaM complex formation. Specific binding of the conserved CaMBD to CaM was corroborated by site-directed mutagenesis, a gel mobility shift assay, and a competition assay with a Ca(2+)/CaM-dependent enzyme. Expression of OsMlo was strongly induced by a fungal pathogen and by plant defense signaling molecules. We propose that binding of Ca(2+)-loaded CaM to the C-terminal tail may be a common feature of Mlo proteins.
12437305	Functional conservation of wheat and rice Mlo orthologs in defense modulation to the powdery mildew fungus.	2002	Mol Plant Microbe Interact	Homologs of barley Mlo are found in syntenic positions in all three genomes of hexaploid bread wheat, Triticum aestivum, and in rice, Oryza sativa. Candidate wheat orthologs, designated TaMlo-A1, TaMlo-B1, and TaMlo-D1, encode three distinct but highly related proteins that are 88% identical to barley MLO and appear to originate from the three diploid ancestral genomes of wheat. TaMlo-B1 and the rice ortholog, OsMlo2, are able to complement powdery mildew-resistant barley mlo mutants at the single-cell level. Overexpression of TaMlo-B1 or barley Mlo leads to super-susceptibility to the appropriate powdery mildew formae speciales in both wild-type barley and wheat. Surprisingly, overexpression of either Mlo or TaMlo-B1 also mediates enhanced fungal development to tested inappropriate formae speciales. These results underline a regulatory role for MLO and its wheat and rice orthologs in a basal defense mechanism that can interfere with forma specialis resistance to powdery mildews.
15352871	Conserved extracellular cysteine residues and cytoplasmic loop-loop interplay are required for functionality of the heptahelical MLO protein.	2005	Biochem J	We performed a structure-function analysis of the plasma membrane-localized plant-specific barley (Hordeum vulgare) MLO (powdery-mildew-resistance gene o) protein. Invariant cysteine and proline residues, located either in extracellular loops or transmembrane domains that have been conserved in MLO proteins for more than 400 million years, were found to be essential for MLO functionality and/or stability. Similarly to many metazoan G-protein-coupled receptors known to function as homo- and hetero-oligomers, FRET (fluorescence resonance energy transfer) analysis revealed evidence for in planta MLO dimerization/oligomerization. Domain-swap experiments with closely related wheat and rice as well as diverged Arabidopsis MLO isoforms demonstrated that the identity of the C-terminal cytoplasmic tail contributes to MLO activity. Likewise, analysis of a progressive deletion series revealed that integrity of the C-terminus determines both MLO accumulation and functionality. A series of domain swaps of cytoplasmic loops with the wheat (Triticum aestivum) orthologue, TaMLO-B1, provided strong evidence for co-operative loop-loop interplay either within the protein or between MLO molecules. Our data indicate extensive intramolecular co-evolution of cytoplasmic domains in the evolutionary history of the MLO protein family.
21457711	TaSRG, a wheat transcription factor, significantly affects salt tolerance in transgenic rice and Arabidopsis.	2011	FEBS Lett	Based on our microarray-analysis results of the salt tolerant wheat mutant, RH8706-49, an unknown salt-induced gene containing a conserved DUF662 domain was identified and cloned; we named this gene TaSRG (Triticum aestivum Salt Response Gene). Real-time quantitative PCR analyses showed that the expression of this gene was affected by salt, drought, cold, ABA and other stress conditions. The overexpression of TaSRG in wild-type Arabidopsis resulted in increased salt tolerance compared with wild-type plants. In addition, subcellular localisation revealed that TaSRG encodes a protein that was found mainly in the nucleus. Our results suggest that wheat TaSRG might encode a transcription factor that could be utilised for enhancing stress tolerance in a wide range of plants.
21771914	Impaired function of the tonoplast-localized sucrose transporter in rice, OsSUT2, limits the transport of vacuolar reserve sucrose and affects plant growth.	2011	Plant Physiol	Physiological functions of sucrose (Suc) transporters (SUTs) localized to the tonoplast in higher plants are poorly understood. We here report the isolation and characterization of a mutation in the rice (Oryza sativa) OsSUT2 gene. Expression of OsSUT2-green fluorescent protein in rice revealed that OsSUT2 localizes to the tonoplast. Analysis of the OsSUT2 promoter::β-glucuronidase transgenic rice indicated that this gene is highly expressed in leaf mesophyll cells, emerging lateral roots, pedicels of fertilized spikelets, and cross cell layers of seed coats. Results of Suc transport assays in yeast were consistent with a H(+)-Suc symport mechanism, suggesting that OsSUT2 functions in Suc uptake from the vacuole. The ossut2 mutant exhibited a growth retardation phenotype with a significant reduction in tiller number, plant height, 1,000-grain weight, and root dry weight compared with the controls, the wild type, and complemented transgenic lines. Analysis of primary carbon metabolites revealed that ossut2 accumulated more Suc, glucose, and fructose in the leaves than the controls. Further sugar export analysis of detached leaves indicated that ossut2 had a significantly decreased sugar export ability compared with the controls. These results suggest that OsSUT2 is involved in Suc transport across the tonoplast from the vacuole lumen to the cytosol in rice, playing an essential role in sugar export from the source leaves to sink organs.
21981410	A plastid protein NUS1 is essential for build-up of the genetic system for early chloroplast development under cold stress conditions.	2011	Plant J	During early chloroplast differentiation, the regulation of the plastid genetic system including transcription and translation differs greatly from that in the mature chloroplast, suggesting the existence of a stage-dependent mechanism that regulates the chloroplast genetic system during this period. The virescent-1 (v(1)) mutant of rice (Oryza sativa) is temperature-conditional and develops chlorotic leaves under low-temperature conditions. We reported previously that leaf chlorosis in the v(1) mutant is caused by blockage of the activation of the chloroplast genetic system during early leaf development. Here we identify the V(1) gene, which encodes a chloroplast-localized protein NUS1. Accumulation of NUS1 specifically occurred in the pre-emerged immature leaves, and is enhanced by low-temperature treatment. The C-terminus of NUS1 shows structural similarity to the bacterial antitermination factor NusB, which is known to play roles in the regulation of ribosomal RNA transcription. The RNA-immunoprecipitation and gel mobility shift assays indicated that NUS1 binds to several regions of chloroplast RNA including the upstream leader region of the 16S rRNA precursor. In the leaves of the NUS1-deficient mutant, accumulation of chloroplast rRNA during early leaf development was impaired and chloroplast translation/transcription capacity was severely suppressed under low temperature. Our results suggest that NUS1 is involved in the regulation of chloroplast RNA metabolism and promotes the establishment of the plastid genetic system during early chloroplast development under cold stress conditions.
21896764	A 5-methylcytosine DNA glycosylase/lyase demethylates the retrotransposon Tos17 and promotes its transposition in rice.	2011	Proc Natl Acad Sci U S A	DNA 5-methylcytosine (5-meC) is an important epigenetic mark for transcriptional gene silencing in many eukaryotes. In Arabidopsis, 5-meC DNA glycosylase/lyases actively remove 5-meC to counteract transcriptional gene silencing in a locus-specific manner, and have been suggested to maintain the expression of transposons. However, it is unclear whether plant DNA demethylases can promote the transposition of transposons. Here we report the functional characterization of the DNA glycosylase/lyase DNG701 in rice. DNG701 encodes a large (1,812 amino acid residues) DNA glycosylase domain protein. Recombinant DNG701 protein showed 5-meC DNA glycosylase and lyase activities in vitro. Knockout or knockdown of DNG701 in rice plants led to DNA hypermethylation and reduced expression of the retrotransposon Tos17. Tos17 showed less transposition in calli derived from dng701 knockout mutant seeds compared with that in wild-type calli. Overexpression of DNG701 in both rice calli and transgenic plants substantially reduced DNA methylation levels of Tos17 and enhanced its expression. The overexpression also led to more frequent transposition of Tos17 in calli. Our results demonstrate that rice DNG701 is a 5-meC DNA glycosylase/lyase responsible for the demethylation of Tos17 and this DNA demethylase plays a critical role in promoting Tos17 transposition in rice calli.
21753115	Rice ethylene-response AP2/ERF factor OsEATB restricts internode elongation by down-regulating a gibberellin biosynthetic gene.	2011	Plant Physiol	Plant height is a decisive factor in plant architecture. Rice (Oryza sativa) plants have the potential for rapid internodal elongation, which determines plant height. A large body of physiological research has shown that ethylene and gibberellin are involved in this process. The APETALA2 (AP2)/Ethylene-Responsive Element Binding Factor (ERF) family of transcriptional factors is only present in the plant kingdom. This family has various developmental and physiological functions. A rice AP2/ERF gene, OsEATB (for ERF protein associated with tillering and panicle branching) was cloned from indica rice variety 9311. Bioinformatic analysis suggested that this ERF has a potential new function. Ectopic expression of OsEATB showed that the cross talk between ethylene and gibberellin, which is mediated by OsEATB, might underlie differences in rice internode elongation. Analyses of gene expression demonstrated that OsEATB restricts ethylene-induced enhancement of gibberellin responsiveness during the internode elongation process by down-regulating the gibberellin biosynthetic gene, ent-kaurene synthase A. Plant height is negatively correlated with tiller number, and higher yields are typically obtained from dwarf crops. OsEATB reduces rice plant height and panicle length at maturity, promoting the branching potential of both tillers and spikelets. These are useful traits for breeding high-yielding crops.
21771866	OIP30, a RuvB-like DNA helicase 2, is a potential substrate for the pollen-predominant OsCPK25/26 in rice.	2011	Plant Cell Physiol	Calcium ions are a well-known essential component for pollen germination and tube elongation. Several calcium-dependent protein kinases (CDPKs) are expressed predominantly in mature pollen grains and play a critical role in pollen. However, none of their interacting proteins or downstream substrates has been identified. Using yeast two-hybrid screening, we isolated OsCPK25/26-interacting protein 30 (OIP30), which is also predominantly expressed in pollen. OIP30 encodes a RuvB-like DNA helicase 2 (RuvBL2) that is well conserved in eukaryotic species from yeast to human. Yeast and Drosophila defective in RuvBL2 are non-viable. The interaction between OsCPK26 and OIP30 was confirmed by far-Western blot and pull-down experiments. OIP30 was phosphorylated in a calcium-dependent manner by OsCPK26 but not OsCPK2, which is highly similar to OsCPK26 in sequence and expression profile. OIP30 unwound partial duplex DNA with a 3' to 5' directionality by ATP hydrolysis. Concurrently, the ATPase activity of OIP30 depended on single-stranded DNA. OsCPK26 phosphorylated OIP30 and enhanced both its helicase and ATPase activity about 3-fold. OIP30 may be the potential downstream substrate for OsCPK25/26 in pollen. This report characterizes a RuvBL in plants and links its activities with its upstream regulator.
21908441	Transcriptional activation of secondary wall biosynthesis by rice and maize NAC and MYB transcription factors.	2011	Plant Cell Physiol	The bulk of grass biomass potentially useful for cellulose-based biofuel production is the remains of secondary wall-containing sclerenchymatous fibers. Hence, it is important to uncover the molecular mechanisms underlying the regulation of secondary wall thickening in grass species. So far, little is known about the transcriptional regulatory switches responsible for the activation of the secondary wall biosynthetic program in grass species. Here, we report the roles of a group of rice and maize NAC and MYB transcription factors in the regulation of secondary wall biosynthesis. The rice and maize secondary wall-associated NACs (namely OsSWNs and ZmSWNs) were able to complement the Arabidopsis snd1 nst1 double mutant defective in secondary wall thickening. When overexpressed in Arabidopsis, OsSWNs and ZmSWNs were sufficient to activate a number of secondary wall-associated transcription factors and secondary wall biosynthetic genes, and concomitantly result in the ectopic deposition of cellulose, xylan and lignin. It was also found that the rice and maize MYB transcription factors, OsMYB46 and ZmMYB46, are functional orthologs of Arabidopsis MYB46/MYB83 and, when overexpressed in Arabidopsis, they were able to activate the entire secondary wall biosynthetic program. Furthermore, the promoters of OsMYB46 and ZmMYB46 contain secondary wall NAC-binding elements (SNBEs), which can be bound and activated by OsSWNs and ZmSWNs. Together, our results indicate that the rice and maize SWNs and MYB46 are master transcriptional activators of the secondary wall biosynthetic program and that OsSWNs and ZmSWNs activate their direct target genes through binding to the SNBE sites.
